binary,multiclass,spanish_translation
Not Hope,Sarcasm,"En realidad, no es 'diferente' en absoluto en que no hay nada en el artículo gay que se muestra mal o incorrecto. tanto para su 'obfuscación'... y previsiblemente, absolutamente ningún enlace de usted... ¿qué tienes que ocultar? considerando el típico fraude desenfrenado cometido cuando los cristianos intentan muchas de estas 'peticiones' contra las uniones civiles, no me sorprende que haya algunos reconocidos como inválidos. aquí hay un vídeo sobre las técnicas que se utilizaron en masachusetts. http://www.youtube.com/watch?v=smgua...eature=related"
Not Hope,Sarcasm,"Bien, estábamos cansados de que no respondieras o dijeras, ""no vale mi tiempo""."
Hope,Sarcasm,"Tal vez debería haber usado la fuente de ""sarcasmo"". Mi error. Iba para el humor no desagradable. Tener un día de durazno.:)"
Not Hope,Sarcasm,Todos ustedes están locos por ser malos con Trump tanto para la izquierda tolerante de todos modos George Floyd tenía que venir
Not Hope,Sarcasm,Por favor... dile eso a una familia de cuatro que no puede pagar cuentas médicas...
Not Hope,Sarcasm,"Me alegra saber que traes ortografía a esto, muestra dónde estás en la discusión, y de dónde vino la pregunta de salvar vidas?"
Hope,Sarcasm,"Me encanta salir de la oficina de médicos llorando, necesito que este chico decida dejar mi cuerpo para que podamos terminar y volver a casa juntos."
Not Hope,Sarcasm,No en tu mente aburrida no tiene mucho claro rey tridente... ¿Por qué no vas a cazar un poco de atún o algo...?
Not Hope,Sarcasm,"Por supuesto que Dios tendría algo que ofrecer a peón humilde, pero eso no explica qué uso tiene Dios para peones humildes, excepto por hacer trucos estúpidos de mascotas."
Not Hope,Sarcasm,Ven a Inglaterra y te encontraré azúcar plumemoticonXBye Usted vinculó todos esos otros abominaciones (aunque eso es rico viniendo de una desviación sexual) junto con la homosexualidad usted viejo sucio. Estábamos hablando de homosexualidad en ANIMALS pothead pero usted sigue insistiendo en su sobre HUMANS (leer las tapas) y luego cambiando el tema a usted y la señora Poeta....intenta mantener el ritmo ! Usted pica .. sin duda sobre itemoticonXChicken
Not Hope,Sarcasm,¿La prohibición dejó de beber? ¿La guerra contra las drogas dejó de fumar? ¿Qué te hace pensar que es diferente con las armas?
Not Hope,Sarcasm,@MailOnline Otro rapero misógino y homofóbico... ¡qué impactante!
Not Hope,Sarcasm,"No sólo lanzaría el interruptor, sino que también pagaría la factura eléctrica."
Not Hope,Sarcasm,Creo que también se puede enseñar el control de armas en una escuela libre de armas. La educación sexual también se enseña en escuelas que prohíben a sus alumnos a la pareja en el patio de la escuela :p .
Not Hope,Sarcasm,que necesita una alarma cuando usted puede tener la voz baja de un extraño para despertarte en la mañana
Hope,Sarcasm,"Espero que vaya un poco mejor con esta marioneta, su propio guardaespaldas fue el último en un montón de intentos de asesinato."
Not Hope,Sarcasm,¿Está justo al lado de ANWR? ¿Los canadienses están minimizando ANWR mientras taladran para extraer nuestros preciosos fluidos? emoticonXClown
Hope,Sarcasm,"Sí, lo superarán en un año o dos."
Not Hope,Sarcasm,"Sí, Ez es lo que volverá a perseguirte. ¿Sabes por qué puedo decir lo que quiera sobre Jesús con consecuencias? Es porque Jesús nunca existió. ¿Sórdido, cuándo vas a crecer?"
Not Hope,Sarcasm,"Ya que te gusta tanto reportar ataques personales al mod, tal vez alguien debería devolverte el favor? emoticonoXRolleyes"
Not Hope,Sarcasm,Ahora estoy leyendo 4 libros a la vez lo que podría salir mal
Hope,Sarcasm,¿De dónde sacó Jesús sus poderes mágicos? Si los ángeles pudieran hacer el drama de mamá antes de la inundación entonces Dios también puede.
Not Hope,Sarcasm,"Y, estoy seguro de que te haces esa misma pregunta antes de descomprimir tu mosca y sacarte el pene, ¿verdad?"
Hope,Sarcasm,"""Numerosos individuos"", suficiente evidencia para mí, supongo."
Hope,Sarcasm,Simone: Soy una víctima crónica: pensé en pedirle una receta a Easyrider.
Not Hope,Sarcasm,"Nunca he oído a un conservador que era pro gay y mucho menos pro matrimonio del mismo sexo. ¿Sabes de alguno? hay un término viejo que parece aplicarse 'si el zapato encaja'. por favor me gustaría saber quiénes son estos conservadores que quieren que la gente gay sea capaz de casarse legalmente. ¿quiénes son? ya que como usted dice que hablo en generalidades entonces usted no debe tener ningún problema en la lista de estos pro gay o por gay conservador matrimonio. sólo porque alguien cree que el gobierno no debe estar en la busisness matrimonial, como un libertario, no significa que apoyan el matrimonio gay."
Hope,Sarcasm,No puedo esperar a nombrar a mis hijos después de cosas que nunca tendré. Mi hija será Hope. Mi hijo será PS5 porque esa mierda es cara.
Not Hope,Sarcasm,"Traté de no parecer un turista cuando fui a Nyc en mayo pasado, pero supongo que lo regalé con todas las fotos que estaba tomando."
Not Hope,Sarcasm,"Eso es un hecho interesante, ¿cómo es que nunca he oído tal cosa..tal vez un enlace está en orden y no un frente de tormenta o el enlace similar por favor.... en realidad he escuchado a gangsta rap... Easy E, Snoop, NWA, y tantos otros, de hecho están en mi camión ahora mismo.. imagine una pelirroja ""blanco"" se divierte en escuchar todo tipo de música.. hmm También tengo Lady Smith Black Mambazo, Nat King Cole, y mientras estamos en ello tengo música que adoro de Irán, Irak, Arabia Saudita, Turquía y tantos no puedo enumerarlos todos... ¿cuál es su punto? Difícilmente llamaría rap a la decadencia de los 90, aparentemente mucha gente escucha si están haciendo dinero.... Me pregunto si usted tiene un pariente loco en algún lugar de su pasado?"
Not Hope,Sarcasm,"¿Crees que el metro es ala izquierda? ¿Qué demonios has estado fumando, ethmi? metro es un trapo sucio del mismo horrible establo que el correo diario."
Not Hope,Sarcasm,¡Buena lección! Siempre toma la salida fácil para tratar de evitar las consecuencias de las acciones. En lugar de dejar una nota en un coche diciendo que accidentalmente te golpeas... deberías conducir casualmente lejos. ¡Gracias Simone!
Not Hope,Sarcasm,"En realidad, sólo tiene sentido para usted. Si usted mira a la naturaleza por un poco de tiempo, usted se dará cuenta de una gran cantidad de muerte. Pero es en su mayoría muy económico ya que los carroñeros se aseguran de que hay residuos mínimos."
Not Hope,Sarcasm,No tendríamos leyes (y muchas importantes) si no puedes hacer un proyecto de ley que no te afecte. ¡Lo sentimos por la legislación de derechos civiles!
Not Hope,Sarcasm,Parece que los nazis de seguridad creen que las zonas libres de armas deberían ser administradas como prisiones. Tal vez los nazis de seguridad deberían hacer un viaje de campo a su sistema carcelario de los estados y preguntar a los guardias si las armas o cualquier otra arma alguna vez llegan a las prisiones. Las prisiones se consideran zonas libres de armas y drogas.
Not Hope,Sarcasm,"¡Silencio, Poseidón! Sé un buen Dios inexistente y aléjate de la zarza ardiente que lo apagarás y entonces estarás realmente en problemas."
Not Hope,Sarcasm,"¿Qué motivó esto? Supongo que tengo que comprobar en qué sitio web estoy... Tu respuesta, Orión, (como trs) es la de un sin agallas, sin espinas, sin dip-wad. Uno que tintineo en sus cajones si usted hizo tal reclamo mientras que frente a mí. Pero, he tratado con su lamentable, basura tipo antes y he encontrado que no importa lo que se dice, usted actuará como si fueras diez pies de alto y a prueba de balas. Pero, continúa, Orión. Has demostrado sus verdaderos colores ahora. Cluck a voluntad... emoticonXChicken emoticonXRolleyes"
Not Hope,Sarcasm,"cita de Johnhanks: 'cita: originalmente publicado por inri ... el sexo es nada más que animalista hasta que se practica de acuerdo con la eucaristía ... estoy fascinado. ¿cómo se hace esto, exactamente? (y sólo para el registro - usted está diciendo realmente hacer el sexo menos animalista es una buena cosa?)' Yo ni siquiera preguntaría!!"
Not Hope,Sarcasm,"Lo has dicho también en otros foros: no tienes $10,000, sólo estás haciendo el ridículo."
Hope,Sarcasm,¿Quién es este dios del que hablas? ¿Puedo llamarlo? Tengo algunas cosas que me gustaría hacer y él sólo puede decirlas mientras que en el teléfono que estoy esperando.
Hope,Sarcasm,@ThePartridgePod Defrost el congelador con el elenco de Hollyoaks. Cualquiera de ellos que quisiera un viaje divertido extra podría ir al centro de reciclaje con algunos tarros pesto vacíos. Magia.
Not Hope,Sarcasm,"Bueno, considerando lo ambiguas y contradictorias que son las escrituras cristianas, supongo que esta interpetación tiene tanto sentido como cualquiera de los demás."
Not Hope,Sarcasm,Fue un intento de ironía que no es fácil de entender para los norteamericanos.
Not Hope,Sarcasm,"Esto se llama lógica extremista. En primer lugar, las sams cuestan millones de dólares y las personas que pueden permitírselos probablemente no pueden permitirse tantos, en segundo lugar, estas d00ds ricas probablemente como su libertad y no estarían tan inclinadas a utilizarlos. En tercer lugar, ¿cuántas personas saben que pueden permitirse un programa de armas nucleares de mil millones de dólares y construir, poseer y mantener un arma nuclear? Esto es absurdo racionar desde la tierra de hacer creer. pero responder a su pregunta si el gobierno puede poseerlo así debe el pueblo."
Hope,Sarcasm,Voy a extrañar a scantrons acortar mi nombre a Cristo después de 16 años
Not Hope,Sarcasm,"Realmente odias la verdad, ¿no es así! Y eres un maestro? Qué pensamiento aterrador que se basa en tu retorcida visión del mundo. emoticonXDonno Tengo mi propio video para que lo veas, uno que no te dice mentiras señalando un par de ejemplos de por qué 10.000 correos electrónicos no exponen el fraude que ha sido perpetrado sobre la humanidad durante una generación ahora. YouTube - John Coleman - Global Warming Scam Aquí hay otro video donde demanda a Al Gore: YouTube - Al Gore demandado por más de 30.000 científicos por fraude Calentamiento Global / John Coleman"
Not Hope,Sarcasm,Así admites que preferirías la ignorancia al conocimiento. ¡Qué triste!
Not Hope,Sarcasm,"Deben sufrir terriblemente en las profundas nieves del invierno canadiense, ¿eh? No es de extrañar que estén vertidos al sur sobre la frontera. pequeños emoticonxcensored ers."
Not Hope,Sarcasm,"Asumo que eres cristiano? sigues todo en la biblia? Supongo que es mejor conseguir la lapidación de sus vecinos que van entonces para trabajar el domingo y usar tela mezclada. oh sí me ofende que quieres matar a la gente gay ya que crees que no puedes ignorar algunas partes de la biblia. eres entonces comandado para matar a la gente gay, prostitutas, y niños de boca inteligente."
Not Hope,Sarcasm,"Estoy seguro de que usted quiso decir ""mediata"" en lugar de ""medicar"" ? O, es OSU una escuela de medicina ? O, ¿sabía usted que el hombre estaba fuera de sus medicamentos ? Exactamente lo que significa su desposesión aparte de que usted está tan frustrado si usted oye de un tiroteo en una República de más de 3 millones que te conduce batty ? ¿Cuántos niños ahogados en cubos de 5 galones entre sus dos postes ? ¿Cuántos en accidentes de coche ? ¿Cuántos de objetos contundentes o cuchillos ? En realidad, la muerte por armas está muy por debajo de la lista así que ¿por qué es ir plátanos cuando se oye de un tiroteo incluso si alguien es asesinado o no ? ¿Usted entiende que hay disparos justificables también ?"
Not Hope,Sarcasm,"Probablemente perdí el tiempo creando este debate. todos saben que los negros cometen más crimen que otras razas. ¿Quién en su sano juicio va a discutir con eso? oh, espera, Aveskde discutiría con un poste de cartel si fuera crucial para mantener su fantástica visión del mundo juntos, tal vez muerda. :) usted está proyectando. usted encontrará que pocas cosas me enfurece o emocionalmente me motiva."
Not Hope,Sarcasm,"Ese activista de los derechos civiles era una canción loca. ""Tú también robarías un televisor si significara intercambiar leche para que tu bebé pudiera comer"". Puhleeeeze...... emoticonoXRolleyes Dame un respiro."
Not Hope,Sarcasm,"Sandra Fluke puede que ni siquiera use anticonceptivos porque puede ser muy bien célibe, sólo Dios... y Urgencias que piensa que es Dios... lo saben."
Not Hope,Sarcasm,"Deja que la buena gente de Hutch me grite ""come mierda"" mientras corro."
Not Hope,Sarcasm,"No puedo creer que intentaras hacer una afirmación tan loca. Claramente, Dios estaba hablando de sexo homosexual, pero no me sorprende que omitieras las referencias bíblicas más inequívocas. emoticonXRolleyes"
Not Hope,Sarcasm,¿Quieres decir que no crees que tienes tu propia religión inventada?? ¡Qué interesante! ¿De verdad crees que estás engañando a Dios? ¿O a nosotros? ¿O incluso a ti mismo?
Not Hope,Sarcasm,"ni; era un deísta que sentía que la mayor parte de la cristianidad era ridícula. [fuente] claramente, el 'Cristiano verdadero' de Jefferson no es en absoluto un verdadero cristiano. de hecho, Jefferson sintió que las creencias que los evangélicos sostienen hoy en día eran absurdas e irracionales. en lugar de abordar mis puntos de la más mínima manera, su respuesta consiste enteramente en esto. (¿cree que estoy sorprendido?) y usted de alguna manera piensa que soy el que está siendo derrotado? pero entonces, con su 'comprensión' de la lógica, nadie se sorprende."
Not Hope,Sarcasm,"Me encanta cómo los flauts derechistas piensan que obama es un musulmán socialista cuando su propio nominado de Vp mentalmente defectuoso es un miembro practicante de la iglesia pentacostal, y un creacionista. al menos la cabeza de obama está atornillada correctamente."
Hope,Sarcasm,"@inkofrealidad @StrangerTings1 @nytimes Estás tan cerca de entender el sesgo de la línea base. ¡Puedes llegar allí, creo en ti!"
Not Hope,Sarcasm,Suena como un americano en un gran todoterreno mirando gasolina de $4/galón con una tarjeta de crédito al máximo escuchando la radio fundamentalista.
Not Hope,Sarcasm,"Me lastimé el pie como hace 3 días, no tengo ni idea de cómo, pero duele presionarlo."
Not Hope,Sarcasm,"Ooops, typo. Lo siento, mi mal. Me imagino que es igual de difícil pasar de contrabando un arma en los EE.UU. como el Reino Unido, sin embargo, aunque no dejes que eso te disuada en su búsqueda de pequeños agujeros en mi argumento. Si un typo que realmente no cambió el punto de la discusión era 'el abismo', estoy muy orgulloso de mí mismo."
Not Hope,Sarcasm,"No bebo y no tengo sobrepeso, pero apuesto a que tienes un mal hábito con comida chatarra y noticias de FOX/patato couch con un pack de seis a tu lado."
Not Hope,Sarcasm,La curva de la herradura fue cretada por el diluvio en la imagen de la herradura inmaculada. ¡ arrepiéntanse paganos!
Not Hope,Sarcasm,"Lo que sea. Primero dices que nadie te está llamando hipócrita, de lo que dices que la gente lo hace, pero es sólo una táctica de ataque. Si alguna vez llegas a un estado mental donde puedas entretener la posibilidad de que un critismo de ti pueda estar arraigado en la realidad, que volver a mi post donde digo ""Por eso..."" y darle una lectura de nuevo. Tal vez aprenderás algo. Hasta entonces..."
Not Hope,Sarcasm,El punto es que la gran mayoría de los bautistas son el <término que ha sido prohibido>
Not Hope,Sarcasm,"¿Y su solución a la crisis económica actual es? Espere, usted no tiene uno; es más fácil ser un guerrero del sillón y criticar en lugar de proponer.emoticonXAngry"
Not Hope,Sarcasm,"¿Por qué tienen que aceptar esto? ¿Por qué el gobierno no encuentra una solución que satisfaga a ambos partidos? Oh, bien, porque eso eliminaría este gran tema en el momento de las elecciones."
Not Hope,Sarcasm,"¿Tienes un problema bíblico con eso, ""Oh Jesús""? ¿O no estás familiarizado con tu propia Palabra inspirada?"
Hope,Sarcasm,"¿Qué parte de ""lo que voy a hacer es usar mi influencia para convencer a los políticos de aprobar leyes de control de armas de sentido común"" ¿no entiendes? ¿Puedes entender el inglés simple? No dije nada sobre ir personalmente a su propiedad y quitar sus armas. supongamos que alguien quería que se bajara el límite de velocidad. kelvin's argumento en contra de que sería como esto- '¿realmente crees que? ¿realmente lo crees tanto que estarías dispuesto a morir por tu creencia? entonces corre en el medio de la carretera cuando ves un coche de velocidad y la esperanza de que cuando el conductor te ve él / ella va a disminuir la velocidad. no le pidas a nadie que lo haga. arriesgar su propia vida al correr fuera en el medio de la carretera.'"
Not Hope,Sarcasm,Pensando en ese tiempo Blizzard tuvo la brillante idea de cambiar el nombre de todos en sus foros a sus nombres reales.
Not Hope,Sarcasm,"¡Y también podría haber sido ALIENS liberal!Oooh. ¿Podemos hacer que los inmigrantes ilegales gays? Me gusta esa inclinación!Tal vez estaban hablando de cómo él estaba ""terrorizando"" a la gente con su sentido de la moda?O tal vez el comentario ""terrorista"" no era ni siquiera con respecto a cualquier cosa que Palin dijo tampoco.Tal vez uno de los chicos pensó que vio a Osama bin Laden en la audiencia!"
Not Hope,Sarcasm,"Buena evasión. Ahora, ¿qué tal si realmente responder a mi post anterior, que era una respuesta a su anterior puesto de ataque!"
Not Hope,Sarcasm,Lo que parece ser montañas para otros defensores de los derechos de los gays son sólo colinas topo a yeemoticonXHoho
Not Hope,Sarcasm,"Hay una cura para eso, se llama escuela, tal vez deberías ir allí."
Not Hope,Sarcasm,"Bueno, con el pensamiento personas desafiadas como slimjim flotando alrededor de ella no es de extrañar que tenemos una agencia pícara sin supervisión atacando a los ciudadanos honestos. Vea Ruby Ridge y Waco para ejemplos."
Not Hope,Sarcasm,"Así que eres pro-vida y odias a los liberales? En realidad los republicanos están siendo liberales en este caso (liberal=gobierno más grande, más leyes), pero supongo que te refieres a los demócratas en esto. ¿Qué pasa si el bebé es un demócrata? Si es un padre democrático es muy probable que crezca democrático y una persona más para tratar de mantener el aborto legal."
Not Hope,Sarcasm,"Entonces usted debe haber esperado que él fuera un mudo en el programa. Él estaba básicamente allí; él no hizo comentarios dignos. Fue tan malo que tuvo que recurrir a una hipotética emocional. Él no tenía sentido, y ese comentario no tenía ninguna parte en la entrevista. Bush no envía niños a Irak. En primer lugar, son voluntarios. En segundo lugar, son mayores de 18 años. Por favor, hágame saber qué comentarios Michael Moore hizo que usted pensaba que eran dignos. Usted podría tener problemas."
Hope,Sarcasm,"Bueno, eso deja salir a la mayoría de la corte suprema cuando RvW aparece! Y por supuesto 1/2 dar o tomar de los votantes sería descalificado si las cuestiones relevantes llegan a una votación. Tal vez deberíamos comenzar un esfuerzo para enmendar la constitución para incorporar su idea!"
Not Hope,Sarcasm,"¿Qué tiene que ver el Big Bang con la evolución? Oh sí, lo sé, NADA Una vez más, el vendedor ambulante muestra que prácticamente no tiene comprensión de la evolución."
Not Hope,Sarcasm,"Oh, eso no es políticamente kerect y secialmente wif el elegido haciendo el mundo disculpas toure no veo que va hacia abajo. Bien, poner unos pocos en nosotros pecado bebé. Danos el trato."
Not Hope,Sarcasm,"Pero usted debe jugar la carta de la raza y asumir que porque me opongo a esta mujer criminal por amenazar la vida de su hijo no nacido al hacerla responsable de su propia mala conducta que de alguna manera soy racista. Su argumento es tan patético como su carácter se encuentra falto, apologista inmoral por todo lo que está mal en este país."
Hope,Sarcasm,"En realidad publicaste algo que tenía sentido, y también fue gracioso, tal vez aún hay esperanza para ti."
Hope,Sarcasm,¡Yo voto por la segunda venida de Cristo está cerca!
Not Hope,Sarcasm,"mi odio a la iniquidad contra tu amor por ella? conseguir un nuevo perro, brummer."
Not Hope,Sarcasm,"En lugar de afirmaciones infundadas y ataques sin fundamento, ¿por qué no proporcionas, oh, no sé, mi ser alguna EVIDENCIA revisada por pares? ¿Sabes, esa pequeña cosa vieja que se requiere para que alguien tome tus afirmaciones salvajes remotamente en serio?"
Not Hope,Sarcasm,"Hey, ¿alguien sabe de alguna organización que tenga reservas masivas de dinero que podrían ser súper útiles para el mundo durante una crisis pública?????"
Not Hope,Sarcasm,"Maldita sea, toma algunas gónadas reales (espera, eres un Lib, así que rasca eso) para reclamar el poder de entrar en las mentes y corazones de las masas... una protesta de los conservadores DEBE ser racista, pero una protesta de Libs es pura y justa, ¿correcto?"
Not Hope,Sarcasm,emoticonXKill emoticonXKill emoticonXKill Tengo 7.62 razones por las que esto nunca funcionaría... también tenemos una carta de triunfo... se llama la constitución.
Not Hope,Sarcasm,¿Así que eres un experto en esto como si fueras sobre la economía de enviar dinero fuera del país?El problema de dejar que gente como tú tome las decisiones es que realmente no tienes ni idea de lo que estás hablando.Es algo que veo en muchos conservadores.
Not Hope,Sarcasm,"¿Por qué es que los izquierdistas son incapaces de realmente permanecer en el tema y responder a lo que un oponente está diciendo en realidad? En una nota adicional, se ve feo por ahí para el partido socialista. Parece que muchos estadounidenses están haciendo lo que hice y votando un boleto republicano recto. El Cinturón de Rust también se ve más y más como si fuera republicano y si eso sucede, todo se acabó para los socialistas. El Senado será entregado a una mayoría republicana también, si el cinturón de óxido sigue girando a la derecha. Buena suerte a todos. emoticonXBye NO REALMENTE, sólo a los conservadores."
Hope,Sarcasm,":p me gustaría! Si lo hiciera, sería tan rico como la Iglesia, que lo hace. emoticonXHoho"
Not Hope,Sarcasm,"Así que dices Dr. Tiggerroo, que mis padres decidieron que sería gay para mí. fascinante. ¿Tienes alguna otra basura increíble que escupir de tu boca. Estoy cautivado por tu increíble inteligencia sobre este tema. suena como si hubieras estado estudiando esto a través de la guardería. crecer, obtener una pista."
Hope,Sarcasm,Creo que voy a presionar a la legislación para que la cirugía del cáncer sea ilegal. Después de que todas las células cancerosas son vida humana también y con tecnología médica moderna podrían convertirse en un ser humano también.
Not Hope,Sarcasm,"No olvide que es más barato alimentarse, tomar pedidos mejor, y son más difíciles de golpear."
Not Hope,Sarcasm,@xNemoooo @McDonaldsUK @tasshx ¿Jura jurar que no has bajado todos los bev s en Acapulco s inmediatamente después??
Not Hope,Sarcasm,"Igual no significa bueno, salvo, o incluso iluminado, preppie. Trate de salir del infierno diciendo a Dios que eres igual a un Billy Graham."
Not Hope,Sarcasm,"Sí, sí, completamente asinine. ¿cómo mejora eso su posición? asinine o no, usted no tiene dúplica lógica. por favor explique por qué usted no diezma. ted bundy mató mujeres jóvenes; usted no pudo diezmar. explicar la diferencia de acuerdo a su opinión sobre la moralidad. usted todavía no tiene respuesta. meses y meses para prepararse, y aquí usted todavía no está preparado. su pretensión es típicamente humano. usted dejó su respuesta considerada en su otro traje. ven. ven. somos realmente creer que si usted pudiera presentar un argumento que usted no? el problema no es mi asinity, pero que su creencia en la moral es una ilusión. pregunta simple: ¿por qué no diezmar?"
Not Hope,Sarcasm,"Por lo tanto, la fe y el argumento de la incredulidad. Si usted encuentra imposible por favor indique exactamente qué parte es imposible. Entonces tal vez un científico real podría tomar el control.Mayor en biología molecular? Ni siquiera un grado completo; no como su ir a hacer algo original."
Hope,Sarcasm,"Tal vez usted puede proporcionar un ejemplo para que pueda ir a la ""escuela"" en él?"
Not Hope,Sarcasm,No fue un insulto... sólo una declaración de hecho. Es probable que tenga tantas o más insuficiencias que tú.
Not Hope,Sarcasm,"Ah?""cabeza rascante""Acabo de despertar,¿qué?elección de la mujer, su cuerpo, pena de muerte?ah ok gotch ya.emoticonXFrazzled"
Not Hope,Sarcasm,"Y tampoco Dios los escribió. Fueron escritos por hombres y no había inspiración divina. No hay diferencia entre la biblia y Margaret Mitchell se ha ido con el viento. Oh sí, lo siento se ha ido con el viento al menos hace la historia correcta."
Not Hope,Sarcasm,"¿No lo sabes? DIOS fue la razón por la que algo que fue enterrado hace 50 años es la misma edad que el bebé pájaro eclosionó hace dos horas.En serio, te llamas a ti mismo un científico y no te postras y le das crédito a Dios por todo? ¿No te NOSOTROS y agradeces a DIOS cada vez que tu microondas se enciende cuando presionas el botón?En serio."
