binary,multiclass,spanish_translation
Hope,Sarcasm,Sería bueno si missguided tuviera stock por una vez.
Not Hope,Sarcasm,Encuéntrame un tiroteo masivo en Utah donde el transporte oculto en el campus es legal.
Not Hope,Sarcasm,"Oh, me encantan los juegos semánticos Bueno, la viabilidad ahora es alrededor de 23-25 semanas de gestación y realmente se basa en el peso más que la edad. Sin embargo, el pasado empuje hacia la intervención heroica ahora se atempera por las discapacidades y complicaciones bastante horribles vistos a la edad más joven"
Not Hope,Sarcasm,"¿Entonces tu respuesta a la pregunta es ""Nada"", Marc?"
Not Hope,Sarcasm,"Claramente no te importa un bledo, porque si lo hicieras entonces tendrías que admitir que estabas equivocado. ¿Significa esto que crees que la introducción de límites de velocidad es una mala idea?"
Hope,Sarcasm,Encuéntrame un tiroteo masivo en Utah donde el transporte oculto en el campus es legal.
Not Hope,Sarcasm,"¿Por qué no puedes conducir un tanque? Sólo tienes que ir a comprar un excedente, reemplazar el motor, comprar algunas tierras para conducirlo (las pisadas son muy duras en el pavimento).El único factor limitante es el costo, así que adelante y disfruta."
Not Hope,Sarcasm,"Ellos pueden rechazar cualquier ceremonia que quieran. Que ha sido \""abierta a todos por años\"" no tiene ningún peso. Es propiedad de la iglesia--que es esencialmente lo mismo que una iglesia que dice que no quiere ceremonias gay en su santuario a las que las iglesias son libres de rechazar.Tal vez las iglesias son impuestas de tales maneras en Canadá pero no en los EE.UU. Dado estos asuntos no estoy seguro de que el HRC está siendo más honesto que el video que están respondiendo."" Entonces si yo poseyera un negocio o una propiedad que entonces podría rehusar vender o acomodar cristianos anti gay fundamentalistas y \Que ha sido \""abierto a todos por años\"" no lleva peso en absoluto.\""Es mi propiedad y no me gusta la inmoralidad de cristianos fundamentalistas anti gay."""
Not Hope,Sarcasm,Qué gracioso. ¿De qué estado de policía estás hablando? ¿De aquel en el que los niños no tienen que mostrar su gratitud espontánea al estado?
Hope,Sarcasm,¿Quién está listo para tormentas de monzón todo el fin de semana?!?!
Not Hope,Sarcasm,Solíamos burlarnos de los hombres ricos para usar 3 en 1 resulta que nunca estaban usando nada en absoluto
Not Hope,Sarcasm,exactamente. y usas este ejemplo para mostrar cómo las feministas son malas madres. sarah maldito palin... de todas las personas... eliges a la peor madre... ¿es incluso feminista? parece demasiado estúpida. editar: solo porque una mujer es seria sobre su carrera no significa que sea feminista.
Not Hope,Sarcasm,Dios tiene emociones wow. que tiene que ser ridiculez cosa que escuché en los viejos días que hablabas como que te enviarían a una granja de cuco. dios te ama dios odia s etc etc etc. lo que un montón de cerdo lavado. ¿qué significa la gente con eso? usted pensaría dios se sentó y desayunaba con usted o algo así. emoticonxwow
Not Hope,Sarcasm,Lo que sea que suene como un goverment oficial ahora ¿por qué tantas preguntas? ¿eh lo que estás tratando de conseguir? Ooaman o debo decir Orden del hombre apóstrofe?
Not Hope,Sarcasm,"Esa es la diferencia entre liberales y conservadores (AKA ""verdaderos americanos). Los conservadores tienen sentido del humor. Los liberales no."
Hope,Sarcasm,"Si sólo Ann Coulter podría informar de un pastel lanzando al administrador como un pequeño bebé llorón malcriado. emoticonXRolleyes Ella es probablemente más de un ""hombre"" que eso aunque. :p Waxy"
Hope,Sarcasm,¿Así que rezo por el azar todas las noches antes de irme a la cama?
Not Hope,Sarcasm,"Así que veamos, usted se refirió a cómo la primera enmienda se aplicó a los estados, publicó la 14a cláusula de privilegios e inmunidades de la enmienda y luego me preguntó si pensaba que algo no estaba claro. Por supuesto, la cláusula de privilegios e inmunidades a menudo se equivoca al haber incorporado la 1a enmienda por personas que no saben lo que están hablando, pero esto es simplemente coincidencia porque usted citó al azar parte de la 14a enmienda, pero implicado todo. Ahora, si lo cambió a lo que dijo anteriormente, ¿sentiría que es una declaración exacta? Probablemente, teniendo en cuenta que no parece entender una diferencia descarada entre ""comprensión original"" y ""constitución original)."
Not Hope,Sarcasm,"Por lo tanto, no contestar argumento, entonces. pensó no. después de todo, ¿por qué discutir cuando lanzar insultos es mucho más fácil? impar, sin embargo, que usted debe ser tan delgada de piel sobre otros insultarte."
Not Hope,Sarcasm,Oh querida. Ahora vamos a ver .. usted no está diciendo que los gitanos no tienen una cultura de robo y violencia. Usted está diciendo que no puedo decir que tienen una cultura de robo y violencia debido a lo anterior? Crecer emoticonoXDonno
Not Hope,Sarcasm,"Bueno, no hay nadie tan ciego como el que no va a ver."
Not Hope,Sarcasm,"Las matemáticas también son confusas, no significa que debamos deshacernos de ellas."
Hope,Sarcasm,"Contigo es bastante fácil, sólo suponemos que es todo BS, funciona cada vez."
Not Hope,Sarcasm,"Um, Bassman, así que tú, la única persona en el mundo que es tan ""pura como la nieve impulsada por el viento"", es la que puede juzgar a otros, incluyendo a los demócratas. Um, para que conste que crecí en la pradera y vi un buen poco de ""nieve impulsada por el viento"" y no era particularmente pura. Una metáfora débil y risible."
Not Hope,Sarcasm,"¿Leíste el OP? ¿Leíste el título? ¿Diferencia sin sentido? Entiendo lo que estás diciendo. También sé que estás cambiando tu argumento. Cuando se demostró que Sanford realmente funcionó en valores familiares, cambiaste tu argumento. En lugar de admitirlo, te quedaste fuera."
Not Hope,Sarcasm,¿Qué hay de esta explicación - usted está leyendo WAAAAAY demasiado en su preciosa Biblia.
Not Hope,Sarcasm,"Si me equivoco, ¿por qué tienes un sinnúmero de hilos que han sido abandonados después de encontrarte con personas que te refutaron? No juego a las escopetas con fraudes. busca en el diccionario. http://www.talkorigins.org/indexcc/ch/ch710_1.html intentarlo de nuevo. basilio uchuya y su esposa admiten haberlos dibujado para venderlos a turistas basados en cómics. ¡te enamoraste de un esquema de turistas! ¡Qué divertido!"
Not Hope,Sarcasm,Tan raro como Venmo no me ha envenenado todavía realmente pensó que yo era el elegido
Hope,Sarcasm,"De acuerdo, y el vehículo en el que viajarán será el Prosperity Express.:)"
Not Hope,Sarcasm,"Está muy claro para mí ahora que usted es demasiado estúpido para entender mi punto, o usted es demasiado gallina para abordarlo. O tal vez ambos."
Not Hope,Sarcasm,mal de nuevo!! .. como se acaba de señalar cortésmente a mí un minueto hace que se trata de ' lo que la terminación se detiene ' y mi respuesta se dirige a esto. es un punto válido .. centrarse en la vida aquí primero para permitir que más vida no deseada venga una parte del sistema. ¿has adoptado un niño no deseado todavía? si no me gustaría presentar que debería centrarse en la energía anti aborto en esos niños primero.
Not Hope,Sarcasm,"He estado contratando científicos por más de 20 años y vas a sacar una referencia wiki, que pueda editarme a mí mismo, para probar que me equivoco? emoticonXWow Dime, ¿alguna vez has conocido a un ingeniero o a un científico? ¿Alguna vez has visto los planes de estudio que toman o simplemente sacas declaraciones de tu posterior?"
Not Hope,Sarcasm,"Debo ser bendecido por estar rodeado de tantos carteles con una línea directa a Dios para que sepan quién es salvo o en el infierno. con cristianos tan bien informados como esto, me sorprende que Dios no se retire y les deje hacerse cargo. después de todo, 6.000 años desde la creación debe ser suficiente para cualquiera."
Hope,Sarcasm,"Buena idea... excepto que en realidad no tenemos que elegirlo para ningún puesto... sólo enviarlo allí. Con suerte, sería decapitado por la caída de la noche en el primer día. emoticonXHoho"
Not Hope,Sarcasm,"Ahí está la OTAN, ha justificado una solución final para el ""problema mexicano""."
Not Hope,Sarcasm,"Me encanta cómo lo que 'personalmente' sientes está en conflicto directo con los estudios acedémicos. ciencia dice fuerza = masa veces aceleración, pero personalmente siento que fuerza = velocidad veces volumen, por lo que debe ser la respuesta correcta."
Hope,Sarcasm,hey hidra - - ¿sabes lo que encuentro increíble? todos los hombres de esta junta que encontraron el embarazo sólo es un inconveniente minro. Estoy ansioso por que me digan más sobre sus embarazos....
Not Hope,Sarcasm,"Usted debe estar pensando en la física... la última vez que miré, los biólogos no estaban tratando de explicar la creación del universo. Sin embargo, tenemos un excelente control sobre la evolución de las especies, y algunas ideas bastante razonables sobre el origen de la vida, que es más de lo que tu biblia nunca se le ocurrió."
Hope,Sarcasm,"Me encanta cómo Bitm puede comenzar todos estos nuevos hilos que irónicamente, decir la misma cosa una y otra vez, sin embargo, de alguna manera cuando presiona para respaldar sus propias posiciones de política continuamente huye de los hilos."
Not Hope,Sarcasm,"Lo que sea. EmoticonXRolleyes creo que estás haciendo una montaña de un molehill aquí, pero eso depende de ti."
Hope,Sarcasm,"Es agradable ver que algunas organizaciones del patrimonio están haciendo lo correcto y poniendo la seguridad de su personal, visitantes y voluntarios en primer lugar. Me pregunto cómo es eso... ...por razones, esto está dirigido a nadie."
Not Hope,Sarcasm,"Y aquí está, corregido para eliminar ese pequeño toque de sensacionalismo que usted siente que es necesario para aumentar el apoyo a su causa."
Not Hope,Sarcasm,"Vaya, buena respuesta. Ya sabes, atacar el lenguaje sucio en lugar de hacer una refutación adecuada te hace sonar tan poco educado e inmaduro como aparentemente eres."
Not Hope,Sarcasm,"No, SS. He dejado muy claro que no tengo ninguna intención de inclinarme a tu ignorancia que tan querido tienes. Pandion ha respondido todas tus preguntas antes en detalle riguroso, y has ignorado sus respuestas. No siento ninguna necesidad de unirme a ese club. Si alguna vez llega el día en que no sientas la necesidad de proteger tu ignorancia, si alguna vez realmente deseas expandir tus horizontes y realmente aprender, entonces sal y consigue un libro de genentics como te lo recomendé. Hasta entonces no veo ninguna razón para que me involucre en una explicación larga que ni siquiera leerás. Estoy seguro de que vas a torcer esto en tu mente para indicar algo profundo, pero entonces realmente no puedo ser responsable de lo que sucede en ese cráneo tuyo, así que no puedo preocuparme demasiado por ello."
Not Hope,Sarcasm,Es genial que haya tomado analgésicos y mi espalda aún me duele.
Not Hope,Sarcasm,400+ días de no hacer nada excepto un débil intento fallido de rescatar a los rehenes suenan una campana? emoticonXBanghead Y la reputación de Reagan por ser una línea dura no tenía nada que ver con Irán. La crisis de Irán había terminado el día en que asumió el cargo. Su reputación vino de sus tratos con los rusos. emoticonXGood
Hope,Sarcasm,Sería bueno que mi cuerpo me dejara dormir...
Not Hope,Sarcasm,"Después de todo, tener un mejor amigo que teje una telaraña de contradicciones y mentiras no puede hacerte daño, ¿verdad?"
Not Hope,Sarcasm,Supongo que lo encontré ahora las cosas que la gente debería fundamentar en afirmaciones que no han hecho.
Not Hope,Sarcasm,"Eres fantástico en ser un intolerante, no tan malo en ser un idiota tampoco."
Hope,Sarcasm,"Por lo tanto, entonces sientes que lo que hiciste fue un pecado. De lo contrario no habrías pedido perdón por ello. Tengo una pregunta. ¿Cuál fue tu motivación para comenzar este hilo? ¿Fue para intentar y de alguna manera probar que una persona puede ser cristiana y tener un aborto? Sólo curiosidad. OMI, tienes razón en que estás perdonado por ello, ya que Dios es un Dios que perdona y ama. Pero espero que no lo hagas de nuevo."
Not Hope,Sarcasm,"Es la primera vez que te veo en esa luz, y no me gusta tampoco, estoy realmente sorprendido por tu postura en este caso. No dejes que todos esos teleevangelistas salgan en tu pasaje secreto. :p para cualquiera que use la Biblia, o la interprete de tal manera, como para justificar algo que parezca contrario a la razón o al ""sentido principal"" de la Biblia. imho, ahí es donde comienza el problema."
Not Hope,Sarcasm,"Así que el diente que dio lugar a Nebraska Man era evidencia - evidencia de qué - un diente. Pero de esa pieza de evidencia los evolucionistas fueron capaces de extrapolar toda una nueva raza de hombres! Así que, ¿sigue siendo?evidencia?? ¿Tanta evidencia apuntando a la evolución? ¿es lo que usted hace de la?evidencia?."
Not Hope,Sarcasm,"Ah, así que cuando cabildeo por buretes para mis clases de química, ¿estoy adoctrinando a mis hijos en los males de la yodometría? Sí, es una estupidez como suena, porque es análogo a tu argumento."
Not Hope,Sarcasm,"primer día de trabajo, y ya he llorado en el trabajo"
Not Hope,Sarcasm,"Sí, porque los índices de Brady y la aprobación de un estado en particular leyes de armas no tienen nada que ver con la realidad en lo que respecta a la delincuencia y la seguridad."
Not Hope,Sarcasm,"Sí, lo hicieron: ""...se comió a sí mismo"". No es de extrañar que estén extintos..."
Not Hope,Sarcasm,"La pregunta importante es: ¿me importa? hitler fue elegido. el hecho de que la gente participe en una ceremonia ritual para consagrar el gobierno del día cada 3 o 4 años no lo hace más o menos válido a mis ojos. explicar por qué China tendría alguna motivación para nuclearizar Europa. hasta que usted pueda hacer eso, todo esto 'china' va a conseguir a menos que usted nos apoye hegemonía global!!' son viejas tácticas de miedo cansadas, miedo fascista típico de aquellos que buscan cualquier justificación para nosotros males que pueden encontrar. China está mal en sus acciones contra tibet. eso no significa que debemos apoyar el comportamiento injusto por nosotros."
Not Hope,Sarcasm,"Hey Siri, ¿cómo dejo de simular?"
Not Hope,Sarcasm,el primer juego no comienza cuando se supone que debe? una tradición UCF
Not Hope,Sarcasm,"Wow, estoy sorprendido. nadie me dijo que vor tenía un hijo ilegítimo. un chip real fuera del bloque ol', las mismas respuestas semi-coherentes, las mismas habilidades de composición, la misma propensión a ondear bandera, la misma ausencia de argumento lógico. noto que las marcas de exclamación doble han reemplazado el período estalla, pero eso puede cambiar después de la pubertad. dono"
Not Hope,Sarcasm,"Sólo por interés, ¿en qué aspecto particular de la ""verdad"" estás hablando?"
Not Hope,Sarcasm,He oído hablar de las familias de cabezas grandes. He oído hablar de las familias de cabezas cuadradas. Incluso he oído hablar de las familias de cabezas cone.... pero las familias de cabezas gays?Hay algo que no está bien en incluir la palabra gay y cabeza en la misma frase. :p
Hope,Sarcasm,Acabo de volver a descargar la aplicación @achievement - vamos a ver si mejora mi rutina de ejercicios!
Hope,Sarcasm,"\""Yo te doy cada planta portadora de semillas en el hecho de toda la tierra y cada árbol que tiene fruto con semilla en ella. Ellos serán tuyos para siempre. Y a todas las bestias de la tierra y todas las aves del aire y todas las criaturas que se mueven en la tierra -- cada cosa que tiene el aliento de vida en ella -- yo di cada planta verde para comer.\"" Y así fue.\""Génesis 1: 29-30"" ¿Quieres decir huesos con tejido blando dentro de ellos, derecho? Leí un artículo sobre ese mes pasado. Era de un T-Rex, sí."
Hope,Sarcasm,"Aceptamos su forfiet. Dos más para ir! Una vez que publiquen, este hilo estará bastante cerrado. Predigo Penfold irá primero, seguido por Jo. emoticonXSmilie"
Not Hope,Sarcasm,"Vive en Arizona, un estado republicano. Eso lo explica todo."
Not Hope,Sarcasm,Me encanta cuando Jonny me hace usar auriculares para ver algo en mi teléfono para que pueda jugar fifa
Hope,Sarcasm,Ven a la fila de patines con el resto de nosotros 'clase baja' incluso compraré una botella de MD 20/20 en mí.
Hope,Sarcasm,"Oye Matt, si ese pincel fuera más amplio, podrías pintar una habitación en solo cinco minutos."
Not Hope,Sarcasm,Así que crees que si un niño amenaza con disparar en la escuela debería ser ignorado como inocente travesura de los niños............ decirle eso a los niños que murieron en Colombine... emoticonXRolleyes
Hope,Sarcasm,"Dakota del Norte: *tiene una semana decente de tiempo* Madre Naturaleza: Ahora voy a salir del sol y traer el más frío de las raínas sobre su super, DUPER FLAT LAND."
Not Hope,Sarcasm,"Los cambios en la junta de estándares de educación NO cambiarán materialmente la manera en que se enseña la evolución en Kansas, ni permitirá la enseñanza del creacionismo o el diseño inteligente en nuestras aulas. Nuestra junta asesora científica de distritos dice que los cambios en el currículo lo hacen ""más exacto en los hechos"", e incluso las personas que redactaron el currículo original no podrían encontrar ningún fallo en los hechos con el nuevo borrador."
Hope,Sarcasm,"¿Por qué dices eso? No tiene sentido.. la competencia es lo que paga las cuentas... oh espera... lo sé, quieres recibir al bastardo más enfermo en el premio CD! Espero que no estés siendo un pedófilo de nuevo?"
Hope,Sarcasm,@Schlippertysch1 @anon_opin Muy bien. Sólo tiene que trabajar en su ortografía ahora
Hope,Sarcasm,"Como he dicho en otro hilo, el argumento que escucho más a menudo de los llamados ""pro-elección"" es que no se puede legislar la moralidad. ¡Bueno, entonces qué se puede legislar? ¡cada ley en existencia es legislación de moralidad! ¡por esa manera de pensar, entonces no deberíamos tener leyes. si alguien secuestra y asesina a su hijo de 3 años, entonces esperemos que el asesino se libere porque no podemos legislar la moralidad!"
Not Hope,Sarcasm,"Oh sí..., ¿cuánto tiempo se tarda en caminar de un extremo del país al otro? ;)"
Not Hope,Sarcasm,No es realmente el parque de pelotas es demasiado ancho. El lugar que usted vive sería más viejo que la tierra. Tome Egipto. Si Moisés escribió Génesis el país en el que vivió fue documentado como más viejo que su creación. No puede ser 6 días. Hombre Negro enojado Xqs me quiero decir Africano Americano enojado (AAA).
Hope,Sarcasm,"Ok, así que @bytereview y yo decidimos grabar en la noche del 6o, igual de absolutamente nada noticiable estaba sucediendo! Justo a tiempo como siempre, para repasar algunos de los mejores ITSBUPs de 2020 - y cómo nos estamos instalando en 2021! Escucha: https://t.co/oaPLwrtcHP https://t.co/za3EHuqcWh"
Not Hope,Sarcasm,"O mejor aún, intenta hacer tu tarea antes de hacer posts. Esto 1) te permitiría tener sentido de toda esa jerga técnica loca, 2) ahorrar Urvogel y la dificultad de romperlos en pedazos y la vergüenza de tener que sentarse a través de ella. Sólo una sugerencia honesta. -GFA"
Not Hope,Sarcasm,"Oh seguro, trata de tomar el camino ahora. pero has olvidado las etiquetas que has puesto tan libremente en nosotros como partidarios de mcstain, como usted lo ha etiquetado? ¿el término tirar de un kronus significa algo para usted? porque lo defines con mensajes como este, ya que ahora busca deshacerse de las etiquetas ofensivas como este: (margen radical religioso de derecha dura) http://www.4forums.com/political/sho...ain#post322462. y esto: http://www.4forums.com/political/sho...t321807emoticonxgood"
Not Hope,Sarcasm,No en el estado de ánimo? Oh veo porque te restringen ya su no en el estado de ánimo para eliminar las regulaciones que no funcionan e insertar las adecuadas que lo hacen. Excelente ignorar el tema en cuestión y no dar ninguna sugerencia para mejorar sobre las leyes y restricciones actuales....
Not Hope,Sarcasm,"Golpea a los imbéciles de calentado sobre, políticamente correcto humanismo francés."
Not Hope,Sarcasm,¿Dónde? No lo veo. ¿Mi cerebro de mono está bien pero mis ojos no son lo que solían ser.
Not Hope,Sarcasm,"¿Cómo explicas cómo El Laboratorio de Evolución Molecular Computacional y Analítica está llamando a una nueva síntesis basada en mutaciones ""sesgadas""???????"
Not Hope,Sarcasm,"¿Confundido? Primero dices que no crees en matar niños a menos que sea ""absolutamente (sic) necesario"", luego dices que no puedes imaginarte un tiempo que sería absolutamente necesario. ¿No puedes decidirte?"
Not Hope,Sarcasm,"Oh ..., bueno ..., supongo que eso lo hace bien entonces ;)"
Hope,Sarcasm,Eso sería un beso infernal... probablemente te ahogarías primero aunque :)
Not Hope,Sarcasm,Tendría una mejor oportunidad de ganar la lotería sin comprar un boleto.
Hope,Sarcasm,Era una pregunta hipotética que ha sido respondida..por favor trate de mantenerse al día.
Not Hope,Sarcasm,"Si portar armas se convirtió en legal, entonces la policía ya no podía arrestar a la gente por portar armas ilegalmente!' emoticonxrolleyes realmente? Supongo que serías más feliz si sólo los 'malos chicos' estuvieran armados, porque eso los haría más fáciles de identificar."
Not Hope,Sarcasm,"Oh, por favor, ¿has buscado en algún departamento de economía, negocios o derecho recientemente?"
Not Hope,Sarcasm,Veo que no sabes nada sobre el tema... apenas una sorpresa.
Not Hope,Sarcasm,"No tienes idea de lo contento que estaba de estar sentado cuando leí esto!!Primero me sorprende que no hayas etiquetado a todos aquellos que dicen ver a los liberales de los OVNIS. Entonces tengo que preguntarme no fue en un momento el RCC decir que éramos el centro del universo,... El sol fue alrededor de la tierra,... la tierra era plana??? No hay nadie más que nosotros.. Todo fue creado para nosotros???Ok voy a ir a tomar un poco de aire fresco y descansar por un momento ya que esto es muy perturbador para mí! .... V.O.R. y estoy de acuerdo en algo. Creo que voy a estar enfermo!! De vuelta en unos pocos."
Not Hope,Sarcasm,"Tenías que traer a Godwin, ¿verdad? >_> ¿Además de qué es bueno un cadáver? No importa que nunca vas a entender mi lógica, así que también podría no perder el tiempo."
Hope,Sarcasm,No hay ningún enlace que yo sepa de............ ¿sabes lo que es cspan? es una cadena de televisión aquí en los EE.UU.......... muestra manifestaciones y protestas entre otras cosas......... ¿de qué otras banderas estás hablando? emoticonxconfundido no sé dónde vives pero en este país sólo tenemos una bandera nacional...... tal vez donde vives quieras proteger el papel higiénico. si vas por él....... emoticonxrolleyes tienes mucho que aprender en la vida joven hombre.....esperanzablemente con la edad vendrá sabiduría.........
Not Hope,Sarcasm,"Uhm, te das cuenta de que los humanos y los chimpancés no son las mismas cosas que los perros, gatos, caballos y tiburones... ¿verdad? No estoy bajo ninguna obligación de abordar el origen evolutivo de cada organismo posible. revisemos los hechos. 1) dije que hay una tonelada de evidencia para la macroevolución, y la hay. 2) di un ejemplo específico, diciendo que podría proporcionar líneas multipe de evidencia independiente apoyando el hecho de que los humanos y chipms comparten un ancestro evolutivo común. y puedo."
Not Hope,Sarcasm,"Hey doofus, no hizo ningún esfuerzo para calificar si esas personas eran transportistas con licencia o sólo tenía un arma en la casa o bóveda en el banco. muchos probablemente son cazadores o personas como usted que posee un 30-06 su mamá le compró :) usted respondió exactamente cómo? Sé porque vi sus primeras 3 respuestas. ¿bebes mucho? ...y a menudo? hasta ahora parece que el 40% de los propietarios no arma hacen la mayor parte de la bebida. eso no significa que no están armados, sólo niegan tener un arma. encuesta descuidada!"
Not Hope,Sarcasm,¿Por qué habrías de mutilar a tu hijo?
Not Hope,Sarcasm,¿Pero debería la legislatura electa basada en parte en la política partidista estar diciendo a nuestros tribunales qué caso a mirar y qué caso a no mirar? Pensé que había una razón por la que teníamos 3 ramas separadas del gobierno.
Not Hope,Sarcasm,"Bueno, supongo que es posible que Dios creó la manzana y la dotó de bajos niveles de cianuro para el propósito específico de castigar al hombre en caso de consumir demasiados. Tal vez en el momento en que se hacía referencia a la manzana era una muy especial como la de Blancanieves."
Not Hope,Sarcasm,"Te estás mintiendo a ti mismo, así que te lo haré saber hasta que la nube del delirio se disipe."
Not Hope,Sarcasm,"No sólo tuve que cuidar pacientes covidios anoche, sino que mi enfermera me dijo que las batas covidias me hacían parecer inwantable. ¡Genial!"
Not Hope,Sarcasm,"Mi madre ha cumplido 39 años, durante los últimos 39 años."
