binary,multiclass,spanish_translation
Not Hope,Sarcasm,"El hecho de que se emitió en MSNBC y Keith Olbermann me dice que sólo se podría inclinar de una manera. ¿Qué limitaciones la Constitución establece para las familias jueces de la Corte Suprema? Pero, por supuesto, los jueces se supone que gobernar en la ""constitucionalidad"" de una ley, no su propia ideología personal, ¿verdad?"
Not Hope,Sarcasm,"Supongo, entonces, que no tienes vida, ¿me equivoco?"
Not Hope,Sarcasm,"Supongo que es una buena cosa que no estaba respondiendo y / o hablando con usted entonces. Pero gracias por su aportación, se ha notado."
Not Hope,Sarcasm,"Escuchar que te amo es agradable y todo, pero ¿alguna vez te ha dicho tu SO que comas mierda? ugh @samduhclam"
Not Hope,Sarcasm,"Ciertamente, un término que nunca había oído hablar; ni siquiera wikpedia lo tiene."
Not Hope,Sarcasm,@kashirenaii Yo nunca iría a seis banderas con u
Not Hope,Sarcasm,"Ochenta y nueve veces. Todavía un socio bastante junior. Debo admitir que no le gusta ser despreciado sin embargo, como lo demuestra Lucas 12:10. Uno puede decir algunas cosas desagradables sobre el Hijo del Hombre, y todo está bien. Pero decir un comentario fuera de color sobre el Espíritu Santo y es tiempo de lagos-o-fuego. Él necesita conseguir piel más gruesa, OMI. ¿Los fantasmas tienen piel, BTW?"
Not Hope,Sarcasm,Así que la manera más rápida de obtener más de 20.000 puntos es no ser serio? comprobar!
Not Hope,Sarcasm,Es todo sobre las mujeres en luchas de vástagos. ¿Qué pasa con las mujeres en luchas de medios interactivos: Ya no gano contra mis amigos en el choque porque se especializan en el maldito videojuego.
Not Hope,Sarcasm,"Según la evidencia, debe haber sido donde su cerebro estaba localizado."
Not Hope,Sarcasm,"Jyoshu, deja de beber la Kool-Aid antes de que tu cerebro esté totalmente frito."
Not Hope,Sarcasm,"hmmm. 'wow ... y esta operación lo hizo a través del riguroso proceso de revisión de administración? de todos modos, aquí hay una pregunta para que usted pueda reflexionar. si dios hizo humano de la suciedad, ¿cómo es que todavía hay suciedad alrededor?' suena como una broma para mí. evc foro: evolución humana (re: si evoluciona de monos, ¿por qué todavía simios?) pero todos sabemos que el arco es incapaz de abrir los enlaces de color azul."
Hope,Sarcasm,"""Solía ser."" ""De vuelta en los buenos días."" Dame un descanso. ¿Quieres tomar una máquina del tiempo a los 50s?"
Hope,Sarcasm,"Si pudiéramos frotar una lámpara de latón, hacer tres deseos y arreglar nuestros problemas de energía inmediatamente, estaría de acuerdo con ustedes. Pero como vivimos en el MUNDO REAL, debemos convertirnos en INDEPENDIENTES DE ACEITE mientras estamos perfeccionando y construyendo una infraestructura de fuentes de energía renovables."
Not Hope,Sarcasm,"No estoy de acuerdo, pero creo que ya es hora de mantener a todo el mundo en un nivel más alto. ¡Deberíamos suspender el matrimonio hetero hasta que limpien su acto!"
Not Hope,Sarcasm,¡¡¡¡¡¡¡¡¡¡¡¡¡¡¡¡¡¡¡¡¡¡¡¡¡¡¡¡¡¡¡¡¡¡¡¡¡¡¡¡¡¡¡¡¡¡¡¡¡¡¡¡¡¡¡¡¡¡¡¡¡¡¡¡¡¡¡¡¡¡¡¡¡¡¡¡¡¡¡¡¡¡¡¡¡¡¡¡¡¡¡¡¡¡¡¡¡¡¡¡¡¡¡¡¡¡¡¡¡¡¡¡¡¡¡¡¡¡¡¡¡¡¡¡¡¡¡¡¡¡¡¡¡¡¡¡¡¡¡¡¡!¡¡¡¡¡¡¡¡¡¡¡¡¡¡¡¡¡¡¡¡¡¡¡¡¡¡¡¡¡¡¡¡¡¡¡¡¡¡¡¡¡¡¡¡¡¡¡¡¡¡¡!!!!!!!!!!!!¡¡¡¡¡¡¡¡¡¡¡¡¡¡¡¡¡¡¡¡¡¡¡¡!!!!!!!!!!!!!!!!!!!!!!!!!!!!!!!!!¡¡¡¡¡¡¡¡¡¡¡¡¡¡¡¡¡¡¡!!!!!!!!!!!!!!!!!!!!!!!!!!!!!!!!!!!!!!!!!!!!!!!!!!!!!!!!!!!!!!!!!!!!!!!!!!!!!!!!!!!!!!!!!!!!!!!!!!!!!!!!!!!!!!!!!!!!!!!!!!!!!!!!!!!!!!!!!!!!!!!!!!!!!!!!!!!!!!!!!!!!!!!!!!!!!!!!!!!!!!!!!!!!!!!!!!!!!!!!!!!!!!!!!!!!!!!!!!!!!!!!!!!!!
Not Hope,Sarcasm,"¿Dónde está tu ""prueba"" de que un ser mágico en los Cielos nos creó?"
Hope,Sarcasm,"Sí, a tu cónyuge potencial le gustarás por tu personalidad después de cumplir con el requisito previo de ser el género adecuado para ellos."
Hope,Sarcasm,Espero que mi clase de trabajo social vaya a involucrar tequila y papas fritas y salsa.
Not Hope,Sarcasm,@brruhia Nah bruh solo lo bebes boca abajo
Not Hope,Sarcasm,"Y no tuve que elegir ser homosexual. Es una inclinación natural. Elegí no esconderme o mentir sobre quién soy. Sin embargo tú eres el que parece estar bajo la ilusión de que ser gay es una opción. Una vez más te pregunto si es sólo una opción, entonces eliges ser gay en este momento."
Not Hope,Sarcasm,"Así que en otras palabras, estás diciendo que en algún lugar a lo largo de las líneas, Dios cambió de opinión."
Not Hope,Sarcasm,"Y tener un hijo con una enfermedad terminal y verlos morir muy probablemente lentamente debido a mi ""alma gemela"". Sí. Estoy pensando si están dispuestos a hacerme pasar que no son un alma gemela en absoluto. >_>"
Hope,Sarcasm,"PORK FACTORY! Sé lo que dijo Bismarck acerca de salchichas y leyes hechas por las democracias, pero PORK FACTORY!!? ¿Quieres decir que todo este tiempo Jimmy Dean ha fabricado lo que compro en el supermercado. Espero que no emplea ninguno de ellos ther durn ILEGALS en su fábrica.emoticonXSmilie"
Not Hope,Sarcasm,Estoy seguro de que esta junta podría usar la ayuda en cuanto a su escenario es bastante risible pero lo que sea. punto ser es si la gente demanda evidencia por qué no darles eso? Prefiero ser un hombre honesto abierto que esconderse detrás de una manija cualquier día.
Not Hope,Sarcasm,"Vaya, eso demuestra que mi memoria a corto plazo apesta. ok la 'cocina' no es ninguna área en particular. entras a la cocina profiriendo insultos."
Not Hope,Sarcasm,"En realidad, me sorprende que no puedas ver eso. Quiero decir, fingir que eres ateo. Si lees lo que acabas de escribir, pensarías que también te lavan el cerebro."
Not Hope,Sarcasm,"Supongo que te perdiste esta parte: El senador estatal Robert Hagan (D-Youngstown) admite que su proyecto de ley es puramente ""lengua en la mejilla"" pero dice que el mensaje es cualquier cosa menos una broma. Siendo una historia de una fuente de noticias gay, tal vez usted vio la palabra ""lengua"" y asumió que habría una descripción vívida de algún acto sexual abominable, por lo que dejó de leer, cerró la ventana de su navegador, cerró su computadora, lo sumergió en desinfectante, etc., etc.. ¿O es esto sólo una prueba de que no lee lo que la gente postea?"
Not Hope,Sarcasm,Tengo todo un Nuevo Testamento. ¿Tienes qué - una boca llena de negación? Cuando llegues al nivel de las obras del NT háznoslo saber.
Not Hope,Sarcasm,"Es curioso, pensé que Heribert Nilsson era botánico, pero no dejes que pequeños detalles como ese se interpongan en tu camino."
Not Hope,Sarcasm,Debe ser una persona porque lo dice ahora. ¿Quizá cambie de opinión otra vez?
Not Hope,Sarcasm,"¿Cómo puedo hacer un argumento ""legítimo"" con alguien que cree que todas las religiones se basan en ""un hombre en el cielo"". Es como discutir sobre la cultura oriental con alguien que piensa que China está en África... inútil. China no está en África Xcaliber... no hay necesidad de google it lol:)"
Not Hope,Sarcasm,No puedo esperar a que esos cheques de $2000 salgan inmediatamente.
Not Hope,Sarcasm,Ok te entiendo que es un campesino oh querido debería haber sabido que nuestra marca (Ireland) es ligeramente diferente...
Not Hope,Sarcasm,":p No tengo ni idea de cómo calificar a los presidentes en estos días, pero este cierto Prez se clasificaría como *wai hasta allí."
Not Hope,Sarcasm,"Me pregunto si debería dejar que la hierba u otra hierba subiera en el patio después de pasar mucho tiempo sodding con fescue. Después de todo, todo es sólo hierba, ¿eh? emoticonXRolleyes"
Not Hope,Sarcasm,¿Quién sino un creacionista haría alguna vez una afirmación tan risible?
Not Hope,Sarcasm,"¿Cómo llenaría algunos de los huecos? Aquí estaba mi secuencia: algo como la vida unicelular a la vida multicelular, conglomeraciones multicelulares aleatorias a una ameba, a un pez, a un dinosaurio, a un mamífero, a un simio, y finalmente a un hombre?"
Not Hope,Sarcasm,¿Es simplista el principio antrópico?¿Qué ley natural creó la ley natural?¿De dónde vino la información?¿Es simplista la materia que crea la materia? ¿Es simplista la materia que crea la información?Aquí; es un pensamiento profundo: ¡Si la materia creó el Universo y si cambia es la mente!
Not Hope,Sarcasm,ik los republicanos r como tryna dicen que ganaron pero idk ¿por qué no sólo resolver esta w una encuesta instagram??
Not Hope,Sarcasm,"Bueno, entonces, ¿por qué no nos dices ""correcto"" punto de vista sobre el matrimonio gay?"
Not Hope,Sarcasm,¿Se supone que debo tomar eso como un insulto o sólo un comentario pasajero?
Not Hope,Sarcasm,"¿Le parece esto un poco irónico a alguien más? O embriagarse es aceptable o no lo es, ¿por qué el método hace que uno sea aceptable y los practicantes de los otros ""perdedores""? Para el registro no bebo, fumo o tomo drogas ilegales."
Not Hope,Sarcasm,"Por suerte para el segundo puesto Brentford que no hay ningún equipo destacado como Leeds este año, o podrían no tener ninguna posibilidad de ganar la liga. #ncfc"
Not Hope,Sarcasm,Me encanta cuando tienes que trabajar tan duro para evitar cualquier punto que hice. Lo tomo como asentimiento a mi post original.
Not Hope,Sarcasm,"Lol. dice que el que ni siquiera se molestó en abrir el enlace de correo específico. huh. otra vez, usted no se preocupa por la evidencia. le di a usted y usted dijo que nunca lo hice a pesar del enlace a la publicación específica allí. mentiroso me llama? bien, supongo que se necesita uno para conocer uno. cuestionable. todo lo que el autor hizo fue declarar que la evidencia rechaza yec. él no argumenta por otra forma de creacionismo. por favor deje de tratar de argumentar que sólo hay una forma de creacionismo. mi dios usted es deshonesto. todavía evitando por qué arco reemplazaría yec con cristanidad eh? aparentemente usted piensa que la intercambiabilidad significa que las palabras significa dos cosas diferentes a pesar de ser utilizado indistintamente como el mismo."
Not Hope,Sarcasm,"cazador, ¿estaría usted interesado en realmente discutir esto lógicamente? ¿o simplemente desea echar fuera las afirmaciones vacías y huir cuando se le desafíe? si su punto de vista es la verdad, entonces usted no tiene ninguna razón para correr."
Not Hope,Sarcasm,"wow, ahí lo tienes otra vez. primero podemos reducir los costos de atención médica contratando a muchos médicos y enfermeras y construyendo muchos más hospitales... que tienen que ser, ya sabes, pagados. ahora podemos reducir las tarifas postales contratando a mucha gente de reparto! que tienen que ser, ya sabes, pagados. en su opinión parece que cualquier costo puede ser reducido gastando más dinero... es fascinante realmente."
Not Hope,Sarcasm,"siete demonios, ¿eh? ¿eso es mucho? pequeña posibilidad de vivir limpio con esos chicos a bordo, ¿eh? interesante. Estoy intrigado de que usted cree en demonios. ¿Existen todavía? Si es así, ¿cómo se manifiestan y cómo usted sabe eso?"
Not Hope,Sarcasm,¿Qué tal hacer que los asesores rindan cuentas? ¡¡¡¡¡¡¡¡¡¡¡¡¡¡¡¡¡¡¡¡¡¡¡¡¡¡¡¡¡¡¡¡¡¡¡¡¡¡¡¡¡¡¡¡¡¡¡¡¡¡¡¡¡¡¡¡¡¡¡¡¡¡¡¡¡¡¡¡¡¡¡¡¡¡¡¡¡¡¡¡¡¡¡¡¡¡¡¡¡¡¡¡¡¡¡¡¡¡¡¡¡¡¡¡¡¡¡¡¡¡¡¡¡¡¡¡¡¡¡¡¡¡¡¡¡¡¡¡¡¡¡¡¡¡¡¡¡¡¡¡¡¡¡¡¡¡¡¡¡¡¡¡¡¡¡¡¡¡¡¡¡¡¡¡¡¡¡¡¡¡¡¡¡¡¡¡¡¡¡¡¡¡¡¡¡¡¡¡¡¡¡¡¡¡¡¡¡¡¡¡¡¡¡¡¡¡¡¡¡¡¡¡!¡¡¡¡¡¡¡¡¡¡¡¡¡!¡¡¡¡¡¡¡¡¡¡¡¡¡¡¡¡¡¡¡¡¡¡¡¡¡¡¡¡¡¡¡¡¡¡¡¡¡¡¡¡¡¡¡¡¡¡¡¡¡¡¡¡¡¡¡¡¡¡¡¡¡¡¡¡¡¡¡!¡¡¡¡¡¡¡¡¡¡¡¡¡¡¡¡¡¡¡¡¡!!!!!!!!!!!!!!!!!!!!!!!!!!!!!!!!!!!!¡¡¡¡¡¡¡¡¡¡¡¡!!!!!!!!!!!!!!!!!!!!!!!!!!!!!!!!!!!!!!!!!!!!!!!!!!!!!!!!!!!!!!!!!!!!!!!!!!!!!!!!!!!!!!!!!!!!!!!!!!!!!!!!!!!!!!!!!!!!!!!!!!!!!!!!!!!!!!!
Hope,Sarcasm,"¿Todavía no lo entiendes, Smiley... EmoticonXBanghead si los pastelitos fueran humanos?"
Not Hope,Sarcasm,"Bueno, eso podría pasar si somhow que mutó en alguna .. no sé ... 600 persona armada. ?"
Not Hope,Sarcasm,Ahora digamos que sólo el 1% de todos los dueños de armas se resistieron (en el nosotros que es varios cientos de miles salpicados a través de la tierra). Con la atención de los medios de comunicación a tales luchas internas entre el gobierno y los ciudadanos ¿cómo lidiar con esto?
Not Hope,Sarcasm,"Pero, ¿no lo sabías? Los EE.UU. son una nación cristiana y todas las demás creencias son sumisos a eso. Ellos no lo entienden, ellos realmente creen que están haciendo el bien y también lo están haciendo por nuestro propio bien. No son los terroristas, o cualquier otra fuerza exterior que son una amenaza a los derechos y libertades estadounidenses, son aquellos como el derecho cristiano a los que realmente tienen que temer. Aquellos como Pat Robertson, o Jerry Falwel que tienen influencia y muchos otros como su presidente. ¿Cuántos otros jueces sienten y creen lo mismo que el juez Moore en Alabama?"
Not Hope,Sarcasm,"\""--Heinrich HimmlerPor prometer su apoyo a los ideales nazis, con orgullo otorgamos \""Sí\"" la Medalla del Holocausto y el Genocidio. ¡Felicidades que ahora eres un partidario de Hitler."" y ganas el premio PINK PANTIES!Tengo noticias para ti PUNK - mi familia huyó de los nazis a pie en la Segunda Guerra Mundial"
Not Hope,Sarcasm,"Por favor, llama al FBI inmediatamente y diles lo que has descubierto, porque no pueden probar que osama bin laden tenía una conexión con el 11 de septiembre de 2001. Eso es correcto. alfombra bombardeamos afganistán y derrocó el gobierno que establecimos allí sin tener ninguna evidencia conectando osama bin laden con el 11 de septiembre. y, a la derecha, entonces invadimos Irak diciendo que también estaban muy conectados. y estabas tan seguro de que Ud. nos atacó? wow, usted debe ser más inteligente que toda la agencia de inteligencia americana. perdón por mi respuesta sarcástica, pero la mentalidad que usted está tratando de empujar hacia adelante es excepto todo lo que el gobierno nos dice y nunca cuestionar sus motivos o acciones. por favor investigar un poco antes de publicar algo como esto."
Not Hope,Sarcasm,"Odio decírtelo, pero definitivamente NO es blanco. Es asiático/africano-americano. Su madre es de ascendencia asiática y su padre de ascendencia africana. ¿De dónde sacas ""blanco""? Ahora un mejor ejemplo de lo que estabas tratando de ilustrar habría sido Barrack Obama, que es exactamente 50/50. Su madre es blanca, de Kansas; y su padre negro, de África (Kenya para ser exactos). Ahora es una verdadera definición de afroamericano. (No importa lo que Alan Keyes pueda decir.)"
Not Hope,Sarcasm,@Ciara87C @RachaelSmarty @SashaHumphreys2 mis convos tinder han sido filtrados
Not Hope,Sarcasm,"En realidad, desde donde se sienta este no creyente, Arch está simplemente repitiendo lo que la Biblia cristiana dice acerca de quién entrará en el cielo y quién no. Hay una diferencia... Pero, usted tendría que saber realmente lo que la Biblia dice para entender que... Lo que a menudo es algo que la mayoría de los no creyentes no leen... De couruse, ni tampoco la mayoría de los creyentes autoprofesantes. IMO, ofenderse por lo que dice la Biblia (y muchas personas repiten) es similar a ofenderse en un libro de cocina que pide sal en una receta que nunca comerás. Ahora, si el cocinero trata de forzarte a comer dicha receta... entonces puedes tomar toda la ofensa que quieras."
Not Hope,Sarcasm,Eso es porque los talibanes en Afganistán no tenían petróleo con el que sobornarlos.
Not Hope,Sarcasm,"¡Oh sí, por supuesto que lo harás, y mientras tanto serás un dictador genocida y la gente todavía amará a tu maldito país en lugar de querer cambiarlo de nuevo! ¡Lol muy divertido!"
Not Hope,Sarcasm,"NO lo es. La evolución ocurre y ha sido observada. Aparentemente te perdiste la biología de la escuela secundaria o la tomaste en Texas (en nuestra clase dijo que había 2 versiones del mismo video, una para Texas donde ni siquiera mencionaba la palabra evolución)."
Not Hope,Sarcasm,"Por lo tanto, Clinton conseguir en él con Lewinsky es una señal de inteligencia? Usted puede trabajar para la administración de Obama con ese tipo de inteligentes. LOL!!"
Not Hope,Sarcasm,The App Store [es]... un milagro económico pero la magia de Apple no funciona hoy en día en #AntiTrustHearings #Apple ahoga la innovación que es el alma de nuestra economía. -Lucy McBath hablando algo de verdad hoy en día #HouseJudicary https://t.co/2swhC9daBM
Not Hope,Sarcasm,"Alguien necesita revisar su Diccionario de Oro. ""Random"" y ""selectivo"" son antónimos. Decir que la selección es aleatoria es admitir la ignorancia del idioma inglés."
Hope,Sarcasm,"No es mi culpa si usted no puede entender lo que estoy diciendo .... orar por la comprensión, no puedo dar o hacer que entienda lo que es incomprensible para usted, pero Dios puede ayudarle, orar. Meditar en él, considerarlo, reflexionar y orar por la guía de Dios."
Not Hope,Sarcasm,"¿Sabes lo que es un concepto novedoso? violadores y agresores sexuales no sólo arruinar las vidas de sus víctimas, sino también sus propias vidas. sí. no las víctimas testificando. tal vez si usted no quería acusaciones de violación entonces DON T RAPE. también un concepto novedoso."
Hope,Sarcasm,Y mi hermana de 8 años piensa que hay hadas en el fondo del jardín.
Not Hope,Sarcasm,"Usa un poco de sentido común, ¿quieres? Y mientras estás en ello, tratando de leer! Dije, y me citaste diciendo:"
Not Hope,Sarcasm,"Tu biblia te ha hecho un gran flaco favor, te ha convertido el cerebro en caca, deberías crecer y dejar de lado tu estúpido libro de cuentos de hadas."
Not Hope,Sarcasm,"Creo que lo entiendo, el objetivo es claro, mira, el autocontrol es bueno, mira, pero no veo qué tiene que ver esto con la OP. ¿Podrías explicar, por favor? ¿A quién recomiendas que use autocontrol? ¿A los manifestantes? ¿O estás diciendo que el autocontrol es tu recomendación para el control de la natalidad?"
Not Hope,Sarcasm,"No, para nada. Lea el post de arriba. 'Claquería de Navidad'?? ¿Qué es eso? Aquí, tenemos galletas Fortune.:)"
Not Hope,Sarcasm,"¿A los Estados Unidos no les importan los derechos de la gente? ¿A los Estados Unidos sólo les importa la opinión de la mayoría? Hrm, eso es gracioso. No recuerdo haber aprendido esa parte en todas mis clases de historia de los Estados Unidos. ¿Cuándo dijeron eso los padres fundadores? ¿En qué parte de la Constitución, la Declaración de Independencia o la Declaración de Derechos podría encontrar tal idea?"
Not Hope,Sarcasm,"¡Dios mío, ¿cómo puedes decir tal cosa?! ¡Tendré que prohibirte incluso por mencionar el concepto de ello! ¡Mi querido viejo amigo!"
Not Hope,Sarcasm,Me encanta cómo difuminan la cara de Tristan en esta temporada de los kardashians LMAO como hmmmm me pregunto quién es ese hombre misterioso
Not Hope,Sarcasm,¡Esas malditas personas negras! ¡Todos quieren respeto e igualdad de oportunidades! ¡Deberían estar contentos con lo que tienen! ¿Por qué deberían trabajar por la misma paga? ¡Son egoístas! [/end sarcasmo] Este argumento está cansado *yawn*
Not Hope,Sarcasm,"Haz, realmente no veo que sea un problema, ¿verdad? No nos dejes en paz con la ortografía y otros tecnicismos de foo foo como este. ¿Entendido?"
Hope,Sarcasm,"Si eso es ser ""salvado"", prefiero ir con el Titanic."
Not Hope,Sarcasm,"Así fue dominando y esclavizando a las mujeres. no significa que debamos hacerlo sólo porque tiene historicidad. en realidad he escuchado esta idea por numerosas personas, en ambos lados de la cuestión. Puedo ver los méritos yo mismo - dar beneficios a las parejas de una manera que no utiliza una institución cultural y religiosa que no tiene nada que ver con la legalidad para empezar. de esa manera al menos el matrimonio cultural no tiene que ser redefinido en ninguna medida y los beneficios legales ya no serían ningún tipo de reflejo de las opiniones culturales e ideológicas de un grupo. por cierto, ¿qué quieres decir con 'anti-gay' en tu frase 'gente anti-gay'? que siempre es importante clavar."
Not Hope,Sarcasm,"Sólo trato de traer algo de coherencia al debate. Le encanta cuando los demócratas se pavonean, pero no cuando los republicanos lo hacen. ¿Por qué no me sorprende? ;)"
Not Hope,Sarcasm,** Así que no me gustan tus mentiras y distorsiones deliberadas. ¿Tengo que admirar tu mendacidad? vivir con el hecho de que mi opinión de tu integridad personal es tan baja que preferiría ignorarte completamente de ahora en adelante.
Not Hope,Sarcasm,"Tal vez usted no es consciente, pero algo que no ha sucedido pero tiene una posibilidad o probabilidad de suceder es potencial, por lo que la palabra es precisa para describirlo. Y como estoy seguro de que Steeeeve (el adorador del diccionario) va a intervenir, aquí está la definición:"
Hope,Sarcasm,"Tener la dieta más equilibrada, un equilibrio saludable de codeína, panadol e ibuprofeno...."
Hope,Sarcasm,"El hecho de que usted piensa que el plan 9-9-9 es bueno sólo prueba que usted es tan estúpido como Herman Cain es. Tal vez usted y Grover Norquist puede conseguir con Herman Cain y comenzar la construcción en el mundo de los sueños utópicos, y no se olvide de pasar por y recoger su otro tonto Ron Paul en su camino."
Not Hope,Sarcasm,Echo de menos subir 3 tramos de escaleras para la clase y tener que recuperar el aliento en el baño
Hope,Sarcasm,"Buena suerte en tu recuperación, químico."
Not Hope,Sarcasm,"tu reputación la savoir faire con notas sucias te precede, querida. no hay necesidad de que el pequeño niño de mamá se mueva por sus pantalones y se exponga un poco más. significa, también, tu ignorancia, no la mía, ya que la conexión entre la guerra de Vietnam, la producción de caucho y fabricantes de neumáticos americanos está documentada y conocida. ve a visitar su fuente local c.i.a. para obtener más información, dw, para empezar. asegúrese de llevar a su profesor payaso nariz con usted."
Not Hope,Sarcasm,"¿Así que ves a un policía en las calles, ves que está armado, eso es suficiente para inducir agresión y violencia, posiblemente hacer que lastimes a otros, simplemente porque viste que alguien más estaba armado?"
Hope,Sarcasm,"Simone bebé Voy a ver su Sanford y criar un Mark Spitzer, John Edwards, Jim McGreevey y por supuesto el rey de sleeze der slickmeister Willie."
Hope,Sarcasm,Increíble lo rápido que este equipo puede ir ganando de 13 derecho a perder tres seguidos. Lol. Horrible gestión esta noche. Realmente espero que este experimento Boone se acabe pronto.
Not Hope,Sarcasm,"¿Quién dice que hay una vida después de la muerte? Espera, gente de hace dos mil años antes de la ciencia."
Not Hope,Sarcasm,"Exactamente, para todos los demás, ""wascallywabit"" tiene mucho más sentido que ""pandion"" que en realidad no responde a ningún problema, es demasiado ocupado admirando lo ""grande que es en biología"". Y si te preguntas por qué me he mantenido callado es porque como ""wascallywabit"" dijo, no me puede molestar la gente arrogante que no escucha la razón."
Not Hope,Sarcasm,"Fue el impulso de Alemania por el nacionalismo lo que llevó a la derrota de Brian, wwll. ¿Quieres repensar tu posición? flash de noticias, Brittan ganó ww2, Germany perdió. Estoy realmente asombrado de que no lo sabías."
Hope,Sarcasm,"Pensé que estarías feliz, quiero decir, demonios, significa que estamos en la iglesia, ¿no?"
Not Hope,Sarcasm,"Wow, un hilo que me trata como un XXXXX lanzando propaganda absurda hacia mí, eso es convincente y gana mis simpatías."
Not Hope,Sarcasm,"Creo que no me entiendes, el color de la piel es genético, estás diciendo que el color de la piel representa genes, estamos discutiendo por lo mismo, lo sé, estoy sorprendido."
Hope,Sarcasm,"""Hopium"" es la adicción eterna de agarrar armas contra los constitucionalistas para esperar que puedan cambiar la Constitución para que todas sus leyes e ideas sean adoptadas. Nota I marcó sus errores de ortografía. ¿Alguna excusa que no sea la falta de una educación?"
Not Hope,Sarcasm,Y aquí el assi una vez más se niega a responder a un puesto válido ya que personalmente insulta a un miembro que muestra más inteligencia y sabiduría que lo que lo hace en cada post COBHC escribe. Y esto viene de un tipo que apenas está fuera de su propia adolescencia. Hipócrita mucho asipiter? emoticonXRolleyes
Not Hope,Sarcasm,"Creo que estás muy equivocado. No soy republicano. Ni demócrata. Nunca se ha registrado como otra cosa que 'independiente'. Soy tal porque creo. A diferencia de un loro de partido que pareces ser tú mismo. Ya que yo no soy... ¿quién diablos puede ser ""yo"" en minoría? Debe ser tu reacción biggoted de rodillas para pensar que cualquiera que no piense como tú y slurp the Flavor Aid es la oposición y como tal debe estar en el 'partido enemigo'. Y tú eres un odiador porque tu verborrea está llena de odio, cáustica y siempre insultante. Y no de una manera divertida, burlona pero llena de vitriol y bilis."
Not Hope,Sarcasm,"¿Y Hannity y Colmes? Sí, también podrías citar a Limbaugh o Coulter o O'Reilly. Todos son igualmente ""justos y equilibrados"". Y el jardín de infantes ""sexo-ed"" era la edad apropiada. Enhorabuena, has comprado una mentira."
