binary,multiclass,spanish_translation
Not Hope,Sarcasm,"Sin duda Matthew! Sólo tenemos esta lujuria por matar gays. Wow, realmente lo clavaste. En realidad estamos bastante bien organizados a. Darth Vader es el presidente del capítulo de VA, por ejemplo. Pronto planeamos lanzar un arma que realmente busca gays....no es que esto importe porque cualquiera que no nos gusta poner en los campos. Tenemos una reunión nacional en unos meses en Montana. Tal vez si usted lleva una bata negra y hacer el apretón de manos secreto no sabrán que eres gay así que usted puede asistir. Tenemos muy buena comida en estos eventos."
Hope,Sarcasm,¿No tienes ese otro foro extraño deformado su publicación en ahora?! Vaya allí con su consejo.
Not Hope,Sarcasm,¿Para que una madre pueda matar a su hijo discapacitado?
Hope,Sarcasm,"¿Estás bromeando? Espero que estés bromeando. no, no es lógico creer en Dios. primero, ¿cómo llegamos aquí? llegamos aquí debido a la evolución. esta teoría lo explica fácilmente. a menos que estés trolling, deberías ver la diferencia entre una foto de África y una foto del avatar de la película. si en serio estás tratando de probar a tu dios comparando cosas de la vida real con cosas de ficción, entonces sí, has probado que tu dios es ficticio. gracias."
Not Hope,Sarcasm,"Me encanta cuando 'heathens' tratan de decirme lo que mi religión hace o no hace. emoticonxrolleyes ah sí, aquí vienen los ataques personales. duo debe estar desesperado de nuevo."
Not Hope,Sarcasm,"Ahora, ahora... deberías saber que la hipocrición está mal... ¡excepto cuando me entrometo en ella!"
Not Hope,Sarcasm,"No estoy interesado en quién no está coqueteando contigo. ¿Quieres una fea, flameante, celulitis gay-choca babosa golpeándote durante tres años o no??? ¿O tal vez una vaina de esas ballenas todos golpeándote?? Para que conste, los gays hacen que la piel de los hombres normales se arrastre, y no de una buena manera. Así que mantener a los paganos espiritualmente desafiados fuera del cuartel de los hombres, y fuera de sus duchas. Sólo porque usted y el resto de la multitud pro-gay piensa que esa clase de actividad depravada está bien no significa que el resto de la sociedad lo haga."
Not Hope,Sarcasm,"Francia tiene cuidado de la salud para todos y una educación universitaria si se puede aprobar el grado. ¿Son, también, un montón de 'cerdos socialistas'? me parece que usted tiene una especie de hombre boogie en su cabeza, es decir, creencias supersticiosas, no nada basado en la razón."
Not Hope,Sarcasm,"La pregunta en el post era acerca de los países no estados de los EE.UU. Entonces, ¿qué tiene que ver su respuesta con el tema de este post?"
Not Hope,Sarcasm,"Me encanta que muchos de los derechos lejanos aman decir que son independientes porque no están de acuerdo con tal vez un tema republicano, o porque tienen una desconfianza general del gobierno... sin embargo, en cada tema (además de tal vez el uno) y cada voto que son bloqueo y paso con los conservadores. Michael salvaje es un comentarista conservador de extrema derecha. eso es lo que es. se puede decir porque todos sus oyentes son conservadores de extrema derecha, o independientes que encajan en la categoría que describí anteriormente. y también se puede decir porque cae en el lado conservador de cada tema, o incluso más a la derecha del lado conservador de cada tema. mientras que estoy seguro de que ayuda a los conservadores de sano dormir en la noche para pensar que lunático de odio no es de su clase, me temo que simplemente no es cierto."
Hope,Sarcasm,"siempre recuerda gracias a tu Alexa, sólo en caso de que la IA se haga cargo un día"
Not Hope,Sarcasm,"ah sí, por supuesto la lluvia de verano se derrama cuando estoy a pie."
Not Hope,Sarcasm,"No estoy seguro de cuál es el umbral para la gezzerdom, pero me temo que lo he pasado."
Not Hope,Sarcasm,Nada de esto tiene nada que ver con lo que escribí.
Not Hope,Sarcasm,"Nunca tendrás ese problema de alivio cómico, siempre serás joven mentalmente."
Not Hope,Sarcasm,"La pregunta es si los perros quieren ser protegidos? Esos pobres perros, por todo lo que sabes que podrían preferir la muerte."
Not Hope,Sarcasm,"Para esta administración, la economía keynesiana es conservadora y FDR era un tacaño."
Not Hope,Sarcasm,"Me encanta llamar a mi mamá temprano en la mañana y despertarla, lo tomo como pago por todas las veces que nunca me dejó dormir en"
Not Hope,Sarcasm,"Mientras ignores la evidencia, ¿por qué necesitas pruebas? La fe ciega funciona bien."
Not Hope,Sarcasm,"Eso es una declaración estúpida, lo suficientemente estúpida como para no poder ni siquiera envolver la cabeza y hacer una comparación adecuada."
Not Hope,Sarcasm,¿Y acusas a Easyrider de manipulación de la Escritura?
Not Hope,Sarcasm,Y eso te convertiría en el único que ES abogando por el asesinato de nuestra futura generación.
Not Hope,Sarcasm,"Gracias por vincular mis declaraciones en las que respondí a su pregunta. Por supuesto, usted, alguien que no cree en nada puede hablar de deshacerse de las religiones y, sin embargo, se lamenta de las persecuciones percibidas por los cristianos."
Hope,Sarcasm,"Nuestro señor y salvador, Frank Ocean, nos ha salvado a todos una vez más."
Not Hope,Sarcasm,"Sí, la universidad es posiblemente la más absurda. Nunca entenderé por qué la gente parece pensar que la mera presencia de un arma hace que de alguna manera sea más probable que haya un problema. Tengo un montón y un montón de armas, aquí en mi casa. El año pasado, la tasa de asesinatos en mi casa fue 0. Creo que lo más probable es que podamos mantener lo mismo este año. ¿En qué escuela estás?"
Hope,Sarcasm,"@Mythical Tan preocupado por él. Pero si usted está buscando salvarlo, basado en la topografía yo diría que está en algún lugar de la costa este. ¿Tal vez las Carolinas?"
Not Hope,Sarcasm,"¿por qué? que no tiene mucho sentido. decimos gas ir más de $ 2 durante un período de demanda relativamente baja. ¿por qué gas estabilizar que un precio que es más bajo entonces lo que fue durante un período de baja demanda cuando la demanda alta se proyecta con el aumento del consumo en China el nosotros y el mundo industrializado en su conjunto? oh sí, estoy preguntando a la persona que piensa que los CDs son buenas inversiones durante períodos de baja inflación. emoticonxrolleyes"
Not Hope,Sarcasm,"Yo creo que usted es un ingenio oscuro que piensa que Nerón tuvo una boda agradable con su esclavo catamita 'con una ceremonia y todo'emoticonXLove http://en.wikipedia.org/wiki/Ptolemaic_dynasty 'Todos los gobernantes masculinos de la dinastía tomaron el nombre de Ptolomeo. Reinas ptolemaicas, algunas de las cuales eran las hermanas de sus maridos, se llamaban Cleopatra, Arsinoe o Berenice. ' Los Ptolomeos en realidad se casaron oficialmente allí hermanas (con una ceremonia y todo) así que de acuerdo con el XXXXX que es Excaliber esto es una gran noticia para los defensores del matrimonio incestual."
Not Hope,Sarcasm,"Ya veo, así que (para ti) no es como si el niño tuviera derecho a su vida o algo por el estilo."
Hope,Sarcasm,Veo que Easyrider quiere que publique algo más. ¡Lo que sea por mi viejo amigo EZ!
Not Hope,Sarcasm,"Pero supongo que esto es todo MY/Our Fault también. ¿Huh Brady?Primero toda la violencia de México fue mi/nuestra culpa hasta que se descubrió que la ATF estaba llevando armas a México, ahora lo que hace un poco de baba en Noruega es mi culpa."
Not Hope,Sarcasm,"Ok, si Max es un hillbilly para su puntuación, entonces usted, Ray, aspira a hillbilly-hood! Max golpear algunos errores tipográficos mientras que hablando de la inteligencia de los demás fue divertido . Usted va tras el inglés de alguien es simplemente ridículo! ¿Realmente no sabes lo horrible que es su escritura?"
Hope,Sarcasm,¿De quién estás hablando? No fue mucho trabajo en absoluto. Una simple búsqueda. Te lo estoy señalando con la esperanza de que consigas material nuevo. Eso y el hecho de que prefiero no verte prohibido.
Not Hope,Sarcasm,¿En serio? Traducción: las únicas enmiendas que se levantan y caen son las que quiero.
Not Hope,Sarcasm,"Oh, sí, es un verdadero teaser. ¿Quién habría pensado que es posible para alguien tener dos padres?"
Not Hope,Sarcasm,"Sí, así que si en mi examen de matemáticas, puse ""La respuesta es 7 porque mi Dios lo dice"" y el profesor lo marca mal, ¿él es el XXXXX?"
Not Hope,Sarcasm,"Nena, detente. Estoy a punto de brillar."
Not Hope,Sarcasm,"Entonces, si tienes una empresa que tiene su 401k con sede en Nueva York, ¿significa eso que tienen que honrar tu inversión en Virginia? ¿Esto también significa que no puedes conducir fuera de Virginia porque los estados de los alrededores no tienen que honrar tu licencia de conducir?"
Not Hope,Sarcasm,¿Tienes que hacer que otras personas vivan tan miserables como puedas para que puedas pasar el día?
Not Hope,Sarcasm,"¿Estás citando otra película de mierda de Michael The Hutt? Hombre, no se necesita un investigador adicto mantenido dos semanas por mil tazas de café para saber que Michael Moore es uno de los productores más izquierdistas, anti-armas, que golpean tropas en Hollywood. ¿Y qué tiene ese gordo ignorante? Es ignorante. Todo lo que tiene es una opinión, al igual que tú y yo. El hecho de que él es una celebridad no lo hace más conocedor que nadie más, especialmente cuando consideras que él piensa que él es el profeta divino del universo, y que todo estará bien y dandy si haces lo que él dice que debemos hacer."
Not Hope,Sarcasm,Usted parece requerir una respuesta hábil a una pregunta complicada - así que ¿qué hay de esto: Pregunta: ¿Fue Stalin un comunista?Respuesta: Eso es lo que dijo que era.Espero que esto sea lo suficientemente lúgubre y vacuo como para cumplir con sus estándares exigentes.
Hope,Sarcasm,Esperaba que hablar en inglés viejo le ayudara a entender.
Not Hope,Sarcasm,"Buen punto aquí, porque los medios de comunicación nunca insultan a los derechistas... emoticonXRolleyes No creo que nadie esté negando que los comentarios de Imus fueron insípidos y ofensivos. El punto que se está haciendo aquí es que él tiene el derecho de hacer tales comentarios. Él no discriminó a nadie. Él simplemente dijo algo estúpido. Si esto va a ser considerado un crimen, todos estaríamos encerrados."
Not Hope,Sarcasm,"Winston, debo confesar mi ignorancia; antes de esto, pensé que sus postes no podrían conseguir más asinine. Veo que estaba equivocado sobre eso. Usted tiene un neumático de repuesto por si acaso? Sólo en caso de un accidente de coche? En caso de que su motor explota? En caso de que alguien secuestró su coche? Enhorabuena, Winston. Usted ha hecho por lejos el poste más asinine que he visto. Y usted es la persona más asinine que he visto nunca."
Not Hope,Sarcasm,"Balderdash, el ateísmo no es ciencia, eso no tiene sentido, y la ciencia es atea de la misma manera que la plomería."
Hope,Sarcasm,"http://66.221.20.150/evidencia/hamilt...smok/file2.htm http://66.221.20.150/forum/files/preg.htm http://www.lcolby.com/b-chap8.htm http://www.lcolby.com/b-chap10.htm http://www.lcolby.com/b-chap12.htm http://www.lcolby.com/b-chap13.htm Geez, ¡qué migrain!Me duele la cabeza por toda esa lectura, Falling!"
Not Hope,Sarcasm,mis vecinos se burlan de mí fuera de mi ventana de la oficina por enfriarse en su bañera de hidromasaje cada día remotamente cálido mientras que me siento aquí en zooms de espalda a espalda todo el día. la audacia es asombrosa.
Hope,Sarcasm,¿Estoy en Canadá como Happy 4rth?
Not Hope,Sarcasm,Y supongo por tus posts mal informados que no has estado drogado antes. ¿Viste recientemente una película llamada Reefer Madness por casualidad?
Not Hope,Sarcasm,"Así que el ""Origen de las Especies"" tiene más información para los evolucionistas teístas que la Biblia?? Cree la evolución teísta en Satanás?"
Not Hope,Sarcasm,"Así que tendrías a la madre, los cuatro fetos mueren en su lugar."
Not Hope,Sarcasm,Y la capacidad de digerir nylon no es una función nueva?? Parece tener una concepción diferente de 'nueva función' que lo que coincide con la realidad.
Not Hope,Sarcasm,"Pensé que Dios les prohibí comer vacas muertas, o era aves de corral? emoticonoXRolleyes"
Not Hope,Sarcasm,"¿Entonces por qué no vamos desnudos y vivimos en un bosque o selva? No quise decir que yo digo que somos diferentes, pero lo mismo."
Not Hope,Sarcasm,"WW, ¿estás hablando contigo mismo? Si no, entonces por favor aprende a atribuir declaraciones a la persona que las hizo."
Not Hope,Sarcasm,¿Así que apoyas permitir que un Uzi de 10 años compre un Uzi y lo lleve a una corte federal o a una escuela mientras no cometa un crimen? Y tu lógica de sacar a criminales de la calle y luego no tener problemas con el control de armas sería perfecta... si tuviéramos un número finito de criminales. Nosotros no. Nuevos asesinos y teiveras y secuestradores de autos y traficantes de drogas y ladrones de bancos y violadores de niños nacen todos los días.
Not Hope,Sarcasm,Así que su desprobado trabajo científico? algunas de las mentes más brillantes en nuestro siglo su refutación de eso? wow! tal vez usted no miró correctamente. hay información probada en un multiverso y un universo finito. hay mapas de un posible universo finito en el que vivimos. y también cuando escribe algo en el Internet surge para lo que usted está buscando no información adicional como el multiverso. les estoy diciendo que hay un universo finito por ahí e incluso podemos vivir en uno. no debe desactivar el hecho de que no lo hacemos!
Hope,Sarcasm,"Si nuestros aliados de Erstwhlle simplemente empezaran a ver el mundo tal como es con el mal inimaginado ya que los nazis casi invadieron toda Europa, yo sería un hombre feliz."
Hope,Sarcasm,"Si el 2020 fuera una nariz, sería mía."
Hope,Sarcasm,"Usted y omegawatsit son el nosotros? o eres la misma persona? lo que sea, me alegro por ti. mantener el estudio y usted puede alcanzar las alturas mareadas de mediados de los años treinta para el próximo año!"
Not Hope,Sarcasm,"Dime genio, ¿cómo es que estoy precisa y correctamente señalando tu error conspirando para desviar a alguien? O estás otra vez usando palabras que no sabes el significado de hacer una declaración tan inexacta, o simplemente estás mintiendo. Entonces, ¿cuál es el penfold, eres ignorante o sólo ser deshonesto otra vez? emoticonXConfundido"
Not Hope,Sarcasm,"1984, ¿eh? Estoy seguro de que todo esto sigue siendo muy relevante. En realidad hay mucha discusión sobre la naturaleza de Archaeopteryx. Gran parte de ella trata de si podría volar y lo que nos enseña sobre cómo las aves llegaron a volar - tierra arriba o árboles abajo. Pero lo que todos acordaron, incluso entonces, era que Archaeopteryx es una transición. Los debates taxonómicos no son realmente muy significativos, realmente. Creacionistas les gusta hacer una gran cosa sobre el hecho de que la mayoría de taxonomistas y ornitólogos clasifican Archaeopteryx como un pájaro. Pero ¿dónde más iría? Eso es una limitación del sistema de clasificación de Linnean - todo se pone en algún lugar, incluso si no encaja exactamente. El único debate sobre la evolución de Archaeopteryx entre los expertos es si evolucionó a partir de dinorsaurs terópodos o de arcosaurs."
Hope,Sarcasm,@MatthewStadlen @sajidjavid Muchas gracias por tus pensamientos perspicaces. Estoy seguro de que @sajidjavid está encantado de que te guste mucho.
Not Hope,Sarcasm,"Así que los creacionistas entre nosotros parecen estar diciendo que no hay ninguna prueba para la evolución, ¿verdad? bien, aparte de los hechos de fósiles, similitudes de ADN, datación de carbono de restos, etc. tal vez usted tiene un punto. pero me parece que hay bastante menos prueba para la existencia de Dios... hmm un libro escrito por la gente hace 2000 años? bien eso es definitivamente un hecho, en lugar de una obra de 'ficción'. y cuánto tiempo atrás fue el mundo realmente 'creado', 20 millones de años o alrededor. ¿qué estaba pasando en esos años entre entonces y el tiempo de Jesús? tal vez Dios estaba dormido. si duerme... hmmmm o tal vez, él no existe... pero otra vez eso no podría ser verdad podría... emoticonxconfundido"
Not Hope,Sarcasm,"Como señaló JP, canadiense, y es mejor que creas que voy a ""hablar"" de mis opiniones. Un poco difícil en un foro como este, ¿no crees?"
Not Hope,Sarcasm,"<Flush>Su propia fuente dijo que hay un acantilado a una milla y media de distancia, y yo soy el mentiroso? Ir a buscarlo y saltar de él, fuego, incompetente, de cerebro dispersado, cretino deshonesto."
Not Hope,Sarcasm,"@GeoffreyBrock6 @RevRichardColes ¿Realmente crees eso? Pondría más fe en la calabaza gigante. Espera un minuto, ¡él es la calabaza gigante!"
Hope,Sarcasm,"Querida Lisa, quiero decirte que estás caliente. caliente como de todas las maneras posibles. de hecho, deberías comer peyote mientras bailas la tarantella. la forma en que hueles como una diosa en celo me hace querer enviarte un correo electrónico y preguntarte si consideras esta propuesta: si te quitas ese botón de arriba tendría el valor suficiente para bajar mi pie grande, mostrando la verruga masiva a ti. ¿te gustan las verrugas?"
Hope,Sarcasm,No tengo un comentario. Sólo me gusta leer esa parte. Ojalá Jyohsu lo leyera una y otra vez hasta que lo entienda. También me gustaría ganar la lotería.
Hope,Sarcasm,"Gracias. Puesto que el vendedor ambulante ha estudiado claramente el asunto en detalle, tal vez le gustaría detallar estas tesis (también soy carpa en latín ;)) para nosotros?"
Not Hope,Sarcasm,"¿Así que el SIDA es la culpa de ""los gays""?EmoticonXRolleyes lol ha pasado mucho tiempo, JP."
Not Hope,Sarcasm,"¡Creo que la decisión de la corte en Nunn vs. Estado de Georgia hizo el mejor resumen de este derecho!"" Sí, todos los liberales aman revocar los casos judiciales que nunca vieron la luz a través del proceso de apelación.Creo que Ohio y su Constitución finalmente prevaleció y ahora llevan abiertos u ocultos."
Not Hope,Sarcasm,"No puedes 'caer' lo que nunca tuviste en primer lugar. nunca fue una persona 'orgullo gay'. es un columnista de chismes que resulta ser gay. usa su cosa 'gay' como un apoyo, la forma en que algunos políticos usan 'cristianidad' como una herramienta para votos y atención. no me sorprende que no puedas decir la diferencia... emoticonxrolleyes"
Not Hope,Sarcasm,"¿Por qué es que la gente no quiere admitir que fue el imprudente gasto de Bush en una guerra lo que no necesitamos, los recortes de impuestos para el 2 % más rico de Estados Unidos, el hecho de que bajo Bush tenían que ADD espacio en el reloj de la deuda, sin mencionar que era tan tonto como una roca, sin embargo, pueden culpar a Obama que heredó este desastre y ha hecho más para sacarnos de él que Bush o cualquier republicano habría hecho. El desempleo es alto, sabemos esto, pero fue en su camino hacia arriba cuando Obama tomó el control porque bajo Bush más corporaciones dejaron este país, más negocios cerraron, a los bancos se les permitió hacer lo que querían sin regulación de ningún tipo, y sin embargo nada de eso es su culpa?.."
Not Hope,Sarcasm,"Como un viejo aficionado a la ciencia ficción, siempre hay una solución de fertilizantes que también reduciría la dependencia del petróleo."
Not Hope,Sarcasm,"No soy bueno en el tema del aborto, pero ¿está usted diciendo que cualquiera que no esté de acuerdo con usted es sexista y arrogante? Esa es una táctica directamente del libro de jugadas de izquierda. Claramente usted es el que es arrogante, si usted puede hacer este tipo de generalizaciones infundadas de sus oponentes. ¿No es usted quien siempre acusa a los conservadores de ser intolerantes a las personas que piensan diferente que ellos? ¡Eso es ironía!"
Not Hope,Sarcasm,"oh también, mi canción con mi novio de secundaria era 143 por Bobby Brackins!!"
Not Hope,Sarcasm,"Corto, pero sin sentido. Este es el tercer post en una fila donde usted ha fallado total y completamente en abordar cualquiera de los contenidos de lo que usted ha citado de mí. Vamos a ver si podemos hacerlo CUATRO!"
Not Hope,Sarcasm,"Así que no importa que alguien muera en sus cuarenta años de hambre y frío porque están sin hogar y sin dinero, mientras que otro vive en lujo con la mejor comida y medicinas hasta sus 80: ambos son iguales? En qué planeta vives, por supuesto que no es el mundo real..."
Not Hope,Sarcasm,"Nunca pensé que diría esto, pero me he convertido en una de esas personas a las que les gustan los bares de recompensas."
Not Hope,Sarcasm,"Creo que si prestas atención, solo encontrarás personajes hetero en el Dr. Seuss. Estoy seguro de que si hubiera alguna sugerencia de gays que Horton escuchara, los derechistas, anti-gays, pseudo-cristianos (¿lo suficientemente específicos para ti?) también estarían tratando de prohibir a Seuss."
Not Hope,Sarcasm,"estudios de 1955, 1961, 1964? Creo que ha sucedido mucho desde esos años."
Not Hope,Sarcasm,"Creo que estamos viendo una guerra cultural. Difícilmente parece una lucha justa sin embargo, ya que sólo un lado tiene alguna.:p"
Not Hope,Sarcasm,"Bueno, supongo que tienes algo allí. . . . . no se puede poner el carro antes de la manguera!!"
Not Hope,Sarcasm,"No tengo ni un lince de África para el día de Navidad de este año, conmocionado e indignado. #Navidad arruinada"
Not Hope,Sarcasm,¿Alguien necesita un cuerpo para un sacrificio humano? Tratando de encontrar una excusa válida para no ir a trabajar hoy.
Not Hope,Sarcasm,"Ese ""por fotón absorbido"" es el regalo. Yo habría querido decirles ""¿no quieres decir que es energía ya que la energía que absorbió fue la energía del fotón?"" Entonces ellos habrían dicho, químico tonto, ¿no conoces la física moderna? emoticonXClown Así que permítanme C&P algunos mensajes del hilo en otro foro, y tal vez se explicará. Pero este tablero no permite [tex][/tex] etiquetas para representar ecuaciones y letras griegas correctamente para que no pueda funcionar tan bonito."
Not Hope,Sarcasm,"¿Alguna vez has visto esos dibujos animados de plympton? donde la cabeza de alguien explota como un globo, y sus ojos salen, y luego su cabeza se colapsa en sí mismo hasta que parece un palo de fósforo quemado? eso es lo que tu post acaba de hacerme. fue una experiencia mental fascinante; así que gracias por eso, de todos modos."
Not Hope,Sarcasm,"Te digo que, mover 100 años luz de la tierra, ahora mirarlo con un telescopio. ver cualquier cosa hecha por el hombre, computadoras por ejemplo? cuerpos humanos? ok ahora volver a la tierra y mirar donde estabas. ver cualquier cuerpo, cualquier computadora, cualquier vida?"
Not Hope,Sarcasm,"Así que usted pediría misericordia para los abusadores de niños, torturadores, asesinos en masa, hitler, etc. wow. (la ironía con su declaración es que la enseñanza cristiana es exactamente lo que usted está diciendo que usted pediría. una persona puede ser el peor ser humano imaginable, y si aceptan a Cristo en su lecho de muerte, van al cielo.)"
Not Hope,Sarcasm,"¿Qué has estado olfateando? ¿una sobredosis de prozac tal vez? ¿alguna vez oído hablar de la libertad religiosa? esto no son las cruzadas. ¿quiénes fueron los que volaron aviones en las torres gemelas? ¿quién fue quien causó que el hombre, las mujeres.niños a ser quemados a la muerte, o fjump a su muerte? ¿quién es responsable del bombero nyc que se mira en el espejo y llora por sus camaradas caídos? ¿cómo te atreves!"
Not Hope,Sarcasm,"¿No celebrarías que Osama está fuera de la foto? Tal vez no organizar una fiesta, pero un ni siquiera un simple ""yippee!""? Sí, claro. Qué carga."
Not Hope,Sarcasm,No me molesté en explicar tus puntos sobre la esclavitud porque no tiene sentido no estoy de acuerdo con tus afirmaciones como sospecho que lo harían la mayoría de los historiadores pero no me sorprende que los cristianos traten de afirmar que terminaron con la esclavitud ya que también tratan de afirmar falsamente que fundaron el país.
Not Hope,Sarcasm,"Me encanta cuando homofóbicos heterosexuales nos dicen lo que es ser gay. Soy una mujer, tal vez debería decirle a todos los chicos que realmente no se lastiman cuando les patean en las bolas. emoticonxrolleyes"
Not Hope,Sarcasm,"Así que si salgo a comprar un coche Brand X y luego me arrepiento un año después, ¿significa eso que a nadie se le debe permitir salir y comprar un coche Brand X? ¿Tengo derecho a tener una opinión y compartirla con otros... seguro. Sin embargo, podrían otros comprar un coche Brand X y nunca arrepentirse... absolutamente. ¿Debería mi experiencia negativa ser usada para evitar que otros se involucren en algo que ellos podrían considerar positivo? Suena un poco fascista para mí."
Not Hope,Sarcasm,Usando mis habilidades de edición de vídeo recientemente adquiridas en mí mismo para variar. Una asignación #presentación oral en #healtheconomics es tan divertida como suena https://t.co/1LKHVyupie
Not Hope,Sarcasm,"Usted sabe, usted y Saddam pueden tener más en común de lo que usted podría haber pensado, pero realmente, creo que pueden estar en algo con Sharia Law, si usted roba, le cortan la mano, bastante buen disuasorio, si usted hace drogas le ejecutan, si usted comete adulterio le apedrean hasta la muerte, pero Saddam pensó que Sharia ley era demasiado duro para ser utilizado en la práctica general."
